"В детстве жили в частном доме. Ванной комнаты у нас тогда не было, умывались во дворе. И вот стою я, согнувшись, умываюсь, напротив сестра стоит, играет со стеклянной бутылкой. Наигравшись, она решила выкинуть ее через себя и попала мне по голове — рассекла лоб так, что кровь хлестала. Мама, увидев меня, гоняла сестру веником по двору и ругалась. А я смотрела и смеялась, хотя было больно. А потом мне пришлось нассать на тряпочку, чтобы мне её приложили ко лбу, и уже сестра смеялась надо мной.   "
"Когда была маленькая, любила хорошенько попрыгать-побегать, лечь и слушать стук пульса в голове. О пульсе я ничего не знала, но была совершенно уверена в том, что в моей голове прыгает маленький кенгуру и каждый раз его представляла. До сих пор его вижу после физических нагрузок.   "
"Я училась в школе-интернате, с возможностью проживания для тех, кто живет далеко. Но перед тем, как я пошла в первый класс, бабушка сказала мне: ""Все, сдадим тебя в интернат"". Ей это казалось шуткой.  Я до сих пор помню, как плакала от осознания того, что не нужна собственной семье. И до сих пор не понимаю, как можно было сказать это семилетнему ребенку, вместо того, чтобы объяснить разницу между школой-интернатом и детским домом.   "
"Когда была маленькая, жили очень бедно. Моя мечта была — съесть одной целый «Сникерс». Под Новый год мама (она работала учителем) купила для новогодних подарков для класса на свои деньги коробку «Сникерсов». Как-то получилось, что деньги маме не вернули, эти шоколадки в подарки не положили, и они остались у нас. Каждый день мама доставала одну шоколадку, резала тоненько, и всем было по кусочку. Мне так и не дали целую шоколадку, даже на Новый год. Зато хватило на всю зиму))   "
"В школе попросили принести игрушки, которыми мы уже не играем — для детских домов. В нашей семье было трое детей, лишних денег (да и игрушек), понятное дело, не было. Мама была на дежурстве, и искать ненужную игрушку пришлось с папой. Мне было жалко, все были любимые. Папе было жалко отбирать у меня, поэтому мы выбрали старого голышка, смотрящего на нас грустными глазами. Его я и отнесла в школу, на что учительница с улыбкой сказала, чтобы такую ценность я оставила себе)   "
"У мамы был большой орлиный нос, у папы — картошкой. В детстве я была впечатлительным ребёнком, и где-то в возрасте пяти лет, когда родители мне сказали, что у меня будет нос как у мамы и у папы вместе взятых, я очень распереживалась. Родители меня после этого разговора дома потеряли. И нашли в кухне, забивающей нос обратно в голову пластиковым кубиком.   "
"На мой 12 день рождения родители подарили мне крутой (по тем временам) велосипед Альтаир. Была очень рада, но покататься удалось только несколько раз. Папа держал пасеку в деревне и уезжал туда на лето. Ему и отдали мой велосипед, чтобы ездить за продуктами в другую деревню. На мои протесты и отказ отдавать подарок сказали, что папе нужнее, и забрали. Больше велосипед я не видела — остался в деревне зимовать, а потом сломался. Спросила маму, почему они так поступили, а она не помнит!   "
"Как-то в детстве в моей дурной голове появилась идея подстричь любимую кошку. Мама, увидев меня с ножницами в руках, сказала, что, если отстричь кошке шерсть, она умрёт. Поверила, испугалась, очень любила кошку. Мне 22. Только недавно осознала, как же сильно мама меня развела.   "
"Дело было в конце 90-х. Привез мне дядя из-за границы два пакета разных вкусняшек: сникерсы, марсы, баунти, жвачки в порошках и в виде зубной пасты. Жили мы небогато, и если мне давали ""вкусняшку"", то с чаем и кусочек. Решила я, пока взрослые не видят, хоть попробовать, но все и сразу, за чем меня и спалили. Бабушка с дядей почему-то начали громко смеяться, а мама побежала за фотоаппаратом. В общем, понадкусывала я не только ""вкусняшки"", но и разноцветное мыло в форме сердечек.   "
"В детстве ела дождевых червей. Брала их, выкладывала на солнце на какой-нибудь листик, сверху банкой стеклянной накрывала и ждала. Через пару часов черви превращались в аппетитные чипсы. Требую звезду Мишлен.   "
"В детстве обожала читать книги. В то время, когда мои ровесники со скандалами читали только то, что им было задано на лето, я читала взахлёб абсолютно всё свободное время. Родители нарадоваться на меня не могли, однако вскоре моё пристрастие к чтению им порядком поднадоело: книги валялись по всей квартире, домашняя работа часто была не выполнена из-за того, что я зачитывалась книжками. А родители других детей считали, что мои просто хвастаются.   "
"Когда мне было шесть лет, папа взял меня с собой на работу. Он начальник, у него был свой кабинет, где меня попросили посидеть. Оставил секретаршу, чтобы присмотрела за мной. Я донимала её вопросами о папе: правда ли он красивый, умный, а ещё почему-то спросила, сколько детей она бы от него родила (мама не хотела заводить второго ребёнка). Дома рассказала маме, что секретарша любит папу, считает его самым красивым и хочет от него минимум двоих детей. В следующий раз меня оставили с охранником дядей Колей.   "
"Когда я была маленькой, отец ушёл от нас. На дворе 90-е, мне лет пять, и я у мамы попросила купить «Сникерс». Мама на последние деньги купила его, и мы отправились в метро. Поезд уезжал, и пришлось нам его догонять. В вагоне обнаружила, что когда бежала, то потеряла шоколадку. Так обидно и жалко себя и маму стало, что до сих пор не могу есть «Сникерсы», сразу вспоминаю этот случай.   "
"Самый лучший день в детском саду: воспитательница собрала нас на прогулку, вместо детской площадки довела нас сначала до ближайшего магазина, где купила всем по чупа-чупсу, а потом до своего дома, где мы всей группой сидели перед телевизором и смотрели мультик ""Маска"". За это на следующий день другая воспитательница накричала на неё при нас. Сейчас я, конечно, понимаю, что отчитали её за дело, но тогда так обидно за неё было.   "
"В детстве нашла клад возле дерева за забором нашей дачи, где я копала могилку для бабочки. Это была жестяная коробка из-под чая, а внутри — деньги. Сумма такая, что можно было купить много сникерсов и Барби. Я никому не сказала — боялась, что отберут. Коробочку зарыла, деньги забрала. Спустя неделю мама спросила, не находила ли я деньги в коробочке, я соврала, что нет. Много лет спустя узнала, что это были её деньги: прятала, чтобы уйти от отца, который пил. А я на них угощала друзей шоколадом.   "
"В детстве я часто спала вместе с родителями. И вот однажды утром (мне было тогда лет восемь) просыпаюсь я оттого, что меня перекатывают по кровати с середины на край. И не успела я и глаза открыть, как кровать ритмично закачалась... Я ничего лучше не придумала, как притвориться всё ещё спящей и ""проснуться"" после того, как родители закончат. Сейчас мне 26 лет, а вспоминать до сих пор противно.   "
"Иногда закрываю глаза и переношусь в тот момент детства, когда прохладным вечером с друзьями сидели и смотрели на необъятное звёздное небо и метеорные потоки на даче в горах. С горы видно мерцающие огоньки города вдалеке. Тишину нарушают только поющие сверчки. А ласковый ветерок доносит свежий аромат трав. Именно в такие моменты вспоминаешь, что чудеса случаются, и жизнь прекрасна.   "
"В детстве за мной присматривал Якубович. Мама включала ""Поле Чудес"", уходила к соседке пить чай, а я сидела смирно около телевизора. На рекламе бежала за конфетами в кухню, чтобы Якубович не видел, как много я взяла. Догадывалась, что в этой истории с няней-Якубовичем скрыт какой-то подвох, но не рисковала конфетами и свободой. Если мама напутала, я не виновата.   "
"Когда мы с братом были маленькими, начитались сказок, и братик мне говорит: ""А я знаю, как попасть в волшебную страну"". Я, будучи маленьким ребёнком, очень обрадовалась, и мы решили, что завтра туда отправимся. Выходные, девять утра, родители спят. Я кое-как написала записку, в которой было сказано, что мы пошли проведать феечек. Брат собрал рюкзак, куда положил мелочь и буханку хлеба. И когда два кабана уже собрались сесть на первый попавшийся автобус, родители нас схватили.      "
"Я шла в школу в 96 году. Семья жила бедно: наряд на 1 сентября мне сшила мама, а бабушка сделала букет из красивейших астр с нашей клумбы, так как денег на покупной букет не было. Я с гордостью вручила цветы первой учительнице, а на следующий день увидела свои совсем не увядшие астры в мусорном ведре нашего класса, в то время как розы и гладиолусы в нарядных упаковках стояли на учительском столе. Обидно было до слез.   "
"В детстве думала, что если вдруг проглотить кошачий волос, то все тело покроется шерстью. Играла с ними, гладила, но сжимала губы во время этого, а потом сразу бежала мыть руки. Понятия не имею, с чего вдруг я это взяла, но искренне в это верила.   "
"На днях нашла свой личный дневник, который вела во втором-третьем классе. Там я писала, что хочу поступить в Проститут (простой институт) и стать проституткой — студенткой этого самого института. Потому что в обычный институт меня уже не возьмут, ведь я получила двойку по математике.   "
"Будучи ребёнком, я обожала Филиппа Киркорова. Я знала наизусть его песни, рисовала его портреты и мечтала, что он приедет и женится на мне. Где-то по телевизору я увидела, как пара занималась сексом, и тогда я залезала в пододеяльник вместе с любимым плюшевым зайцем и целовала его, шепча: ""Ох, Филипп, как же я люблю тебя, я только твоя"". Так продолжалось, пока меня не застала мама. Как же она смеялась, до сих пор вспоминает. А мне стыдно до одури, каждый раз краснею, когда вспоминаю это.   "
"Лет в 12 в меня выстрелил из лука своего отца один придурок — припугнуть хотел, но перестарался. В шоке я быстренько дал ответку побледневшему недострелку; пошёл домой и был сразу послан матерью вынести мусор; а когда она-таки увидела моё состояние, впала в истерику, и весь путь до больницы её успокаивал я. Некоторые в небольшом городке до сих пор помнят мальчика со стрелой в плече, орущего на окружающих: ""Что уставились?! Человека ни разу не видели?! С луны, блять, свалились что ли?!""   "
"В глубоком детстве гуляла во дворе, подходит сосед, здоровается, а я, убей, не помню, кто это. Естественно, со всей детской наивностью спрашиваю: ""А вы кто?"" Он отвечает: ""Я Ленин папа"". Не долго думая, я категорично отвечаю, что Ленин давно умер, и папой вы быть не можете! Он засмеялся и пояснил, что он папа девочки Лены с пятого этажа.   "
"Когда мне было года четыре, папа работал на заводе. И, как это раньше бывало, ему давали молоко ""за вредность"". Я была уверена, что папе дают молоко, потому что он вредный. Всякий раз, слыша эту фразу, представляла, как папа безобразничает у себя на заводе и не слушается директора, а ему дают молоко, чтоб задобрить его и перевоспитать =)   "
"В детстве мы с братом лето проводили у бабушки. Это был Муссолини в юбке: строила нас и кричала за любую провинность — опоздание на обед, грязную одежду, плохо выполненные поручения, всякие бытовые мелочи… Но была у нас отдушина — ночь. Спали мы на чердаке и ночью делали, что хотели: слушали музыку, читали, смотрели звездопад, ходили в соседнюю деревню гулять. Это была наша свобода. В памяти до сих пор сохранился ее запах — сена, цветов и ночной прохлады.   "
"Мои родители, когда я была маленькой, всегда ломали голову над новогодним подарком для меня. Так уж завелось, что я писала письмо деду морозу, как только научилась это делать, а отец приносил замазку и проверял письмо (мне было крайне важно, чтобы ошибок не было), письмо на утро я бросала в почтовый ящик.  Вот только в письме я всегда просила дедушку прислать побольше лакомств для моей морской свинки и попугая, просила подарки для родителей (помню, мама кружку свою разбила, а отец мечтал о бильярде), слезно умоляя ""оформить"" подарки на меня, ибо взрослым и животным уже не полагается. В конце всегда была приписка, что, если у меня не закончится вдруг лимит на подарки и останется возможность на последний — пусть это будут длинные красные волосы, как у Ариэль... В общем, да, так из года в год было.   "
"В детстве завидовала персонажу из песни Макаревича, у которого жизнь была ""похожа на фруктовый кефир"". Мне казалось, это значит, такая же вкусная. Истинный смысл дошел много позже.   "
"В детстве родители как-то затеяли ремонт. Выпал он на мой день рождения, а я к тому моменту позвала почти весь класс. Мама устроила нам классный праздник: начиная с того, что у детей спросили, с чего начать торжество. Когда вся довольная детвора кушала торт вместо положенного второго блюда, мама принесла фломастеры и мы рисовали на обоях — кто где мог достать. Ремонт благополучно сделали после дня рождения, а одноклассники до сих пор вспоминают тот день с улыбками.   "
"В детстве думала, что дедушка Ленин — это дедушка моей двоюродной сестры Лены. В моей голове все было логично, потому что он жил возле площади Ленина. И когда моя бабушка говорила, что сейчас увижу дедушку Ленина, думала — за какие заслуги ему поставили памятник.   "
"Эх, скоро осень. В моём детстве знакомый всем дворник собирал листву в кучи, а потом мы, дети, прыгали в них, кидались листьями. После жгли костры, пекли картошку, нанизывали на палку хлеб и держали над костром. Все чумазые, пропахшие костром, сопливые и счастливые шли крепко спать. А сейчас вроде всё есть, хочешь — ресторан, шашлыки… Но, чёрт побери, вспоминая это время, кажется, детство было самое счастливое!   "
"Когда я была в детском садике, к нам в группу на две недели определили двух молодых девушек-практиканток. Мне они очень нравились: добрые, придумывали интересные игры, читали сказки на тихом часу. В первый день их практики меня, счастливую, забрал из садика дедушка. Я в красках рассказала ему, как прошёл мой день и как было здорово. Только вот слово ""практикантки"" я перепутала со словом ""проститутки"". Дедушка весь вечер потом допытывался, что за странный детский садик у меня и что там происходит.   "
"Живу в Венгрии, замужем. Всё у нас славно: и дом свой, и работа, и достаток нормальный. Муж часто балует меня разными десертами вроде венских вафель, булочек, шоколада, орешков. Но я-то никогда не забуду вкус самой дорогой сердцу сладости — блинчиков с сахаром, приготовленных мамой на воде, потому что даже на пакет молока не хватало.   "
"В детстве с братьями открыли свой тату салон. Нам с юга привезли родственники разные переводные тату, я из коробки сделала кассу, даже чеки выписывала, а братья были мастерами и били татухи. Чувствовали себя бизнесменами. На вырученные деньги мы покупали сладости и угощали клиентуру.   "
