"В детстве мы с братом летом жили на даче. Каждый день в любую погоду мама водила нас на большое озеро неподалеку. Однажды ночью в озере утонули две девушки, полезшие в воду по пьяни. Все соседи это обсуждали, мы тоже услышали, огорчились, но все равно упросили маму вести нас на озеро. И вот мы плаваем, а кумушки из ближайших домов орут что-то типа: да как вы можете, здесь люди вчера утонули. А мама как-то оправдывается... С тех пор много лет прошло, а я все еще думаю: права была мама или нет…   "
"Недавно с мамой разговорились про то, какая я в детстве неугомонная была. Прихожу я к бабушке и прошу у неё простынь. Она дала, подумав, что мы в дочки-матери играем, застелить что-то надо. Но она вышла на улицу и чуть не поседела: я с верхушки дерева прыгаю с простыней, как с парашютом. Люлей я отхватила и больше так не делала, но только у этой бабушки; у другой я с пакетом ""майка"" прыгала и тоже получила.   "
"Первого сентября, когда я пошла в свою новую школу (я переехала из города в село), мы с моими одноклассниками встали на сцену, чтобы рассказать стихи. Когда очередь дошла до меня, я вышла вперёд, но все почему-то начали смеяться. А после какой-то папаша с задних рядов крикнул: ""Она словно ангел в подземном царстве"". Я расстроилась и подумала, что они хотят обидеть меня. Но мне объяснили: белокурая и светлокожая я в своём белом платьице очень выделялась на фоне смуглых и загорелых детей.   "
"Когда я была мелкой, была жвачка «Love is…». Я собирала от неё вкладыши пачками, обменивалась ими с друзьями. Однажды, когда мне было лет семь, я увидела мультик с персонажами из этих фантиков, мальчиком и девочкой, и так он мне понравился, что я до сих пор помню то чувство уюта и радости, ту яркую картинку мультфильма, даже немного помню сюжет. Иногда вспоминаю о том мультфильме и не могу никак его найти. Интернет молчит. А был ли этот мульт вообще?..   "
"С детства любила листать коллекцию журналов, которая хранилась дома в серванте. Там были десятки экземпляров самых разных тематик: «Наука и жизнь», «Бурда», всякие Космополитены. Ещё не умея читать, а потом и умея, я пересматривала их помногу раз. А моими любимчиками были выпуски ""Плейбоя"". Я смотрела их тайком, хотя они лежали в прямом доступе. Как мне нравились фото обнажённых красивых женщин! Сейчас я замужем, но тяга к женскому телу имеется. Чем руководствовались мои родители - неясно.   "
"В 98 году папа притащил домой компьютер! Вот так радость! И установил игру для меня, но играли мы с ним вместе. Как-то папа уехал в командировку, а я так хотела поиграть, села за компьютер, он загрузился, кричу маме: ""Как дальше-то?"" Мама говорит: ""Нажми кнопку «Пуск» и увидишь свою игру"". Пока мама готовила еду на кухне, я целый час нажимала пальцем на экран, где написано «Пуск», плакала, думала, сломала комп. Пока не пришла мама и не показала мне, что существует еще и мышка)))   "
"Детство и юность пришлись на начало 90-х. Денег было немного, одежды тоже (как следствие первого плюс дефицит). Тогда покупали то, что могли достать, и неважно, какого это было размера. Помню, лет в 7-8 мне купили итальянские полуботинки 39-го размера на большой подошве из натуральной кожи, даже не знаю, где родители раздобыли (это был ""космос"" в то время). Как многое тогда ""на вырост"" убрали в кладовую, пока нога дорастёт. Нашли, когда мне стукнуло лет 13-14, и нога стала 40-го размера. Ничего, носил год.   "
"Мне исполнилось пять лет. Мама пригласила много гостей. Все приходили с подарками. Я с радостью принимал поздравления и спешил распаковать всё, что мне дарили. Соседка вручила мне цилиндрический свёрток, перемотанный бечёвкой. Это нечто было упакованною в серую бумагу, в такую в СССР заворачивали всё. В моём воображении внутри был игрушечный каток, самосвал или пистолет. Но внутри оказались сандали! Сандали в подарок на пять лет! Я сказал: ""Именинника обидели"", — и залился слезами горя и печали.    "
"В детстве мы любили гулять на территории завода железобетонных изделий. Как-то раз наткнулись на интересную для нас находку. А было это хранилище гудрона. После непродолжительного времени один из нас увяз, и мы вспомнили пиратский кодекс, который гласит: ""За теми, кто отстал — не возвращаться"", — и оставили друга там.   "
"В детстве все время со мной что-то случалось. Сбивала машина, на голову падали качели, горячим железным прутом рассекли бровь в миллиметре от глаза; выбегая из подъезда, вырезалась в трубу. Это я не считаю падения с крыш, сломанных пальцев, разбитого носа после съезда с горки в лавочку. Как моя мама все это выдержала - не знаю, но интересно не это. Тогда я ничего не боялась, для меня это все казалось фигней. Но сейчас я боюсь даже пролетающего жука… Где это бесстрашие? Вернись, без тебя реально сложно.   "
"С самого детства у нас была компания: я, моя сестра и наша подруга. Все примерно одного возраста. Когда были совсем маленькие, кто-то пустил слух, что, когда видишь мертвое животное на дороге, нужно взяться за волосы, иначе они выпадут. Сейчас мы выросли, живём в разных городах, встречаемся редко. И однажды наконец-то нашли время; гуляем, болтаем. Видим мертвого голубя и как по команде хватаемся за волосы. Дружба, она сквозь годы и города.   "
"Однажды мы насобирали очень много клубники. Мама тогда сказала, что я могу съесть, сколько хочу. Ну я и съела всю, не задумавшись, случайно, можно сказать. Приходит мама, видит пустую кастрюлю и ребенка, смотрящего мультики. Клубники было пять килограммов.   "
"Мама в детстве говорила, что когда собака спит калачиком, то это к холодам. Поэтому своему псу я не давала так ложиться, искренне веря, что из-за него могут наступить холода.   "
"Когда мне было лет 5, мне в руки попала советская книжка про зайку, который заблудился в лесу. Иллюстратор там, видимо, был больной ублюдок, потому что мрачнее нарисовать эту историю нельзя - серо-коричневые сосны нависают над серо-коричневым испуганным зайцем. До сих пор снится тот лес. 25 лет прошло, и я поняла, что сама стала тем зайцем - бегу-бегу, а лес все еще нависает, а мне все еще страшно.  "
"Говорят, дети не любят, когда родители пьют. Так вышло, что несколько лет в детстве я жила с тётей (маминой сестрой), ей тогда только-только 20 исполнилось, и я, пятилетняя, на неё свалилась. Я её очень любила, и она меня, но я прямо была в восторге, когда она прибухивала. Мне скупалось все, что можно: любые игрушки и сладости. А наутро тётя с бодуна ворчала, что я, козявка мелкая, опять развела её, хоть я никогда ничего не просила, она сама предлагала каждый раз и говорила: «Бери, что хочешь»))   "
"Когда я была маленькой, на вопрос: ""Кем ты хочешь стать?"" — всегда отвечала, что ""дворником, продавать сигареты и работать в тюрьме"". На самом-то деле я дочь из приличной семьи (родители — педагоги). Просто мне очень нравилось злить бабушку, её ответ на этот бред всегда был таков: ""О Господи! Хай Бог мылуе! Шо ж це за дитина така!"" От этих речей я была в восторге)) А сейчас стыдно, что заставляла любимую бабушку нервничать.   "
"Когда была маленькой, не всегда понимала, что имеет в виду мама, когда она на меня ругалась. Например, когда она кричит, что я довела ее до белого каления, я слышала «колена» и всю ссору пристально смотрела на ее колени, боясь, что они побелеют. Или когда она говорила, что я вот-вот доведу ее до ручки, я смотрела на дверную, воспринимая эту фразу как обещание прекратить ссору и уйти)   "
"Я ненавижу запах болгарского перца. Раньше относилась нормально, но однажды, когда мне было лет 10, моя мама решила заморозить на зиму овощей, в том числе и перца. А в морозилке была куча мороженого. И всё оно провоняло болгарским перцем! А новое родители не покупали, пока не иссякнут запасы старого. И я давилась этим мороженым с запахом перца. С тех пор запах болгарского перца не переношу, сразу ассоциации с тем ""чудесным"" мороженым из детства.   "
"Хоть свое детство я провела в деревне и так же как все стреляла из рогаток, и пробовала на вкус все, что видит глаз, но только в 23 года узнала о существовании тутовника. Была шокирована и уже 4 года мечтаю попробовать эту чудо-ягоду. Ощущение, что меня где-то наебали, никак не проходит...   "
"В 90-е отчим моей тёти часто уходил в затяжной запой. Выносил из дома всё, воровал ночью деньги из кошельков. И вот однажды приехали мы к ним в гости, разговорились. Тётя решила моей маме показать, как, а точнее где, прячет деньги. Место это оказалось под огромным ковром, на котором стояла тумба с телевизором и кресло. Я своим детским умом решила, что так делают все, и потом, приходя к кому-то в гости, незаметно прощупывала ножкой ковёр во всей комнате)   "
"В детстве мы с подругой надевали мамины бюстгальтеры и брали лыжную палку, изображая стриптизерш. Как только вижу старую подругу (давно не общаемся), становится стыдно и смешно одновременно))   "
"Когда я училась в 6 классе, моя мама подарила мне мобильный телефон. Это был сименс А52 или типа того, тогда в классе ещё ни у кого таких не было. И в журнале, благодаря которым можно было купить мелодии на телефон, заказала я себе тогда пищащую мелодию: ""Тутси - самый, самый"", и каждые полчаса ставила будильник, типа мне звонят. Мне казалось, я была нереально крутой)   "
"Радует новое поколение. Я не прям стара, но у нас был один телик в семье, и, чтобы посмотреть ""Фабрику звезд"", я делала папе массаж каждый день, ""зарабатывала"", чтоб занять телик. Но папе ""Фабрика"" и так нравилась, поэтому и разрешал, кайфовал всю неделю, а потом делал вид, что смотрит ради меня. А мой младший брат (разница 11 лет) все смотрит в инете, хоть с компа, хоть с телефона… Эх, молодость :)   "
"Я ненавижу спать на первом этаже, особенно около окон. Этому есть одна причина: в детстве я ночевала в старом доме своих бабушки и дедушки, у них на первом этаже было большое окно. Вот я сплю около него, но вдруг проснулась и, блять, увидела в окне мужика, смотрящего на меня! Я обосралась, хотя чего там... заорала на весь дом! Он, увидев, что я проснулась, убежал. После этого я несколько месяцев спала вместе с мамой.   "
"В детстве на одном из деревенских застолий, где собрались все родичи, один мой дядька сильно напился и стал гоняться за детьми. Мы от него бегали, но он оказался крепким мужиком и с изрядным постоянством кого-нибудь догонял. Догнавшего заставлял крутить обруч :)  Самая веселая вечеринка)))   "
"Как-то в детстве я услышала, что если обрезать или подровнять кончики волос, то они будут быстрее расти. У меня от природы очень длинные и густые волосы и ресницы. Вот я и подумала, что, если я обрежу реснички, они вырастут ещё длиннее и будут ещё красивее. Обрезала маникюрными ножницами. Два месяца ходила, как рептилоид))   "
"В детстве была непоседа и постоянно находила приключения на пятую точку: то в крапиву упаду, то об стекло порежусь, то с дерева съеду и ссадин нацепляю. Но когда я пришла домой после того, как мне зарядили солью в задницу при попытке украсть яблоки, сидя в тазике с водой, я наконец-то поняла, что, кажется, пора закругляться...   "
"Второй или третий класс. Меня почти всегда оставляли на продленку. А в тот день сестра забрала меня пораньше. И мои друганы что-то натворили на продленке. На следующий день учительница вызвала родителей. И моих тоже. Я пытался объясниться, мол, не был, не участвовал. Ее ответ помню до сих пор: ""Такое без тебя натворили... Страшно подумать, что с тобой было бы"". Родителей все-таки вызвала.   "
"Мое детство пришлось на кризис, и жили мы в деревне. Сладкого хотелось нереально. Маме дарили коробки конфет, она их берегла на шкафу. Пока никого не было, я доставала коробки, каким-то образом доставала конфеты, что не было видно воровства, и ставила все на место. Однажды мама достала коробку, открыла, а там ничего. И так около пяти коробок. Мне было жутко стыдно.   "
"У нас небольшой коллектив, отношения довольно неформальные. Недавно у меня был день рождения; начальник, поздравляя, чмокнул в щёку и немного царапнул щетиной. Сразу вспомнила детство, папу, дедушку и почувствовала себя маленькой девочкой. Как мужчина он мне совершенно не нравится, но такой восторг накрыл от этого маленького путешествия в детство!   "
"В детстве всегда думал (и даже хотел), что меня в любой момент могут снимать для какого-то сериала или фильма, поэтому всегда старался красиво ходить, кушать, общаться и только дома мог расслабиться и вести себя как попало.   "
"Всегда, когда передо мной идет человек с сигаретой и бросает ее на землю, мне кажется, что она сейчас взорвется, и я стараюсь пройти быстрее. А всё потому, что в детстве дворовые пацаны под ноги петарды бросали. Детство прошло, а фобия осталась.   "
"В детстве, когда лепили с бабушкой вареники, я делала один волшебный вареник для дедушки. Пихала туда побольше соли, перца и чеснока. А он это ел и приговаривал, что всё равно вкусно. На самом деле я просто его ненавидела и хотела хоть как-то ему насолить, потому что он тиран и до сих пор обижает мою семью. Я не могу жить полной жизнью после многочисленных психологических детских травм.   "
"В детстве на даче кормила с разрешения соседей их коз. В тот день у меня с собой был полиэтиленовый пакет с овощными очистками. Просунула его через решётку, и один самый нетерпеливый козёл вместе с очистками зажевал сам пакет. Я тянула изо всех сил, но тщетно. Козёл проглотил его. Ревела всю ночь, ведь собственными руками убила животное. Рассказала. Всем посёлком ждали новостей. А козёл выжил. Бегал он ещё довольно долго, пока однажды зимой злая участь его всё-таки не настигла — на мясо пустили.   "
"В детстве гуляли с подружками, нам было лет по 12. Увидели в сквере огромную собаку породы сенбернар, надели на неё веревку, будто поводок, и гуляли так с собакой по посёлку. И ведь не боялись. Не знаю, как дети 90-х вообще выжили.   "
"В детстве я очень любил играться со стационарным телефоном у нас в квартире. Я просто набирал случайный номер и спрашивал у них всякую хрень. И вот как всегда набираю рандомный номер, спрашиваю всякую хрень, и тут вместо женского голоса, что был раньше, я услышал грозного такого вояку, и он мне говорит: ""Пацан, ты вообще откуда знаешь наш номер, пиздуй давай!"" И бросил трубку. Как потом оказалось, я случайно позвонил на военную базу в Калининградской области. Попал так попал 😆   "
