"В мае 94-го года мне исполнилось семь лет. В садике уже был выпускной, а до школы ещё три месяца. Мама отдала меня в санаторий дневного пребывания, находился он за городом в дачном посёлке. Там-то я и разбила казенный графин, очень боялась наказания и позвонила бабуле. Бабушка была шеф-поваром в другом санатории в другом дачном посёлке в противоположном конце города. Сказала, что есть у неё такой графин, и она мне его даст с радостью.  В сон-час, уговорив старшую подружку, а именно восемь лет ей было, вылезли через окно и поехали к бабушке. Ехать нужно было с конечной остановки одного автобуса до центра города, там совершить пересадку на другой автобус и ехать до конечной уже этого маршрута. Денег у нас было только в один конец и только на одного, поэтому для кондуктора я была шестилетней сестрой моей подруги.  Бабушка была в шоке, когда я к ней заявилась за графином, но сдавать меня не стала, назад отправила с дедом на машине. Когда приехали, нас уже во всю искали, дедушка там что-то наплёл им, и родители ничего не узнали о нашем путешествии.   "
"Когда я была маленькая, мы жили в своём доме. Как и у всех, у нас был огород, в котором было три грядки с зелёным луком. Когда лук начинал цвести — начинался ад, ведь цвёл он большими белыми цветками, на которые летели бабочки. Самые разные бабочки сидели на луке. Многие скажут: ""Красивое зрелище, чего такого"", — но я их боялась до жути из-за их липких лапок и ярких крыльев (очень боялась именно из-за крыльев). Помню свои фото, где я с ужасом смотрю на эти создания.   "
"В детстве у меня был свой собственный «салон красоты» и постоянный VIP клиент. Я обожала свою работу и могла даже заплести косички на короткие волосы, или сделать массаж головы, плеч или рук.  Сейчас мне 27, разболталась с папой, и он рассказал, как он обожал мой салон: это был лучший способ спать и играть с ребенком одновременно! :) "
"В детстве дедушка меня обожал и баловал, таскал за собой повсюду. Как-то принёс мне красивейшее платье, а я, капризный глупый ребёнок, отказалась его целовать из-за жёсткой щетины. Столько лет прошло, а я до сих пор помню его поникший взгляд и то, как он старательно выбривал лицо старенькой электробритвой. Мне было шесть, и я не знала, что это последний год, когда мы видимся.   "
"Когда я училась в первом классе, мама приготовила коробку конфет в подарок учительнице. Я тайком подъедала оттуда конфеты (они были в обёртке) и заворачивала туда зубчики чеснока, они показались наиболее подходящим предметом для замены конфет. Потом запечатала коробку так, чтобы не было видно, что её вскрывали. Представляю глаза учительницы. До сих пор стыдно.   "
"В детстве жил на седьмом этаже, и когда ходил в туалет тот, кто жил сверху, по трубам был слышен звук смывающейся воды. Я думал, что он уже сходил в туалет, и мой бачёк наполнился его «смываниями». Жутко боялся подымать крышку бачка аж до 14 лет, пока не начал прятать там сигареты от родителей.   "
"Когда мне было четыре года, я и мой отец поехали с утра купаться на Волгу. Мы провели там весь день, позже он встретил друзей — мужа и жену. Они отправлялись с ночёвкой через Волгу, и мы поехали с ними. Мы переночевали в палатке, с утра я ела сгущённое молоко, тогда я попробовала его впервые и запомнила на всю жизнь этот сладкий вкус. Вернувшись домой вечером следующего дня, моя мама встретила нас с криками и ревом, думая, что мы утонули. До сих пор помню её глаза, и как она меня прижимала, и плакала.   "
"Покупаю дочери много игрушек — пирамидки, мячики, погремушки. Такое ощущение, что покупаю я это всё себе, потому что она в это не играет. Любимые игрушки — провода, бутылка с водой и пылесос. Эх, а я бы в своём детстве душу продала за то, что у неё есть сейчас)   "
"Лет в 9-10 у меня была проблема: очень долго не могла уснуть, во сколько бы ни встала, но стабильно засыпала в газельке папы. Каждый вечер мы просто выезжали и катались по району. Я засыпала, а он тащил меня домой и укладывал в кровать.   "
"Помню, когда мне было лет шесть, мой брат гулял с девушкой (увидела из окна, как они сидят на лавочке), решила выйти к нему поиграть. Он огрызнулся и сказал мне идти домой, а я завопила, что всё расскажу маме. Девушка, видимо, решила, что я его дочь, и начала на него орать, а я смылась под шумок.  Таких пиздюлей от брата я никогда не получала.   "
"Нам было лет по 14, городские дети. У большинства источником знаний о сексе были любовные романы в мягких обложках (интернета и доступного порно не было), но многим хотелось произвести впечатление взрослых и опытных. Одна девочка после каникул пересказывала такую книжку, заменив Майкла на Мишу, а Калифорнию на свою дачу. Когда дошло до любовной сцены, возникла заминка — не было на даче домика для прислуги. Спалилась, в общем, наша ""опытная"".   "
"В детстве моей любимой игрой была игра в салон красоты, где я проигрывала невъебенные диалоги со своими ""клиентами"", записывала девочек, красила себе ногти и болтала о своей пафосной жизни. Длинные названия сокращались, маникюр превратился в маник, а педикюр, соответственно, в...  Эта история о том, как родители быстро прикрыли мой бизнес.   "
"Я не очень красивая. У меня кривые зубы (верхние сильно выступают вперёд), полная, раньше была очень замкнутой, носила очки, и в детстве был энурез. И вот смотрю я на разные истории людей, которых гнобили одноклассники только за один из этих пунктов, и очень удивляюсь, потому что меня никто никогда не гнобил. Я не могу назвать своих бывших одноклассников такими уж добрыми, но меня они никогда не трогали. До сих пор не могу найти объяснение этому феномену.   "
"В детстве часто играли вместе с соседом. Много что творили всякого. Решили как-то капсулу времени закопать с желаниями своими. Через год выкопали, но не учли, что река поднимается весной, залило записки. Сидим на берегу, он спрашивает: «Что ты загадала? Я загадал, чтобы мы вместе были, чтобы любила ты меня». А я сижу, вид загадочный делаю, на него не смотрю. И стараюсь не выдать радости от того, что записки не читабельны. Пусть думает, что желания схожи. Я-то ведь загадала Baby Born...   "
"Мне и моей подруге было лет по восемь, когда я пригласила ее к себе в гости, угостила чаем с халвой из семян подсолнечника! Оказывается, на подсолнух у нее была аллергия. Уже дома, когда она вернулась от меня, сильно отекла и опухла. Вроде как был отек Квинке. Ее родители сразу же расспросили, где она была в этот день и что кушала. И пришли сразу же ко мне домой с разборками, кричали и ругали меня, восьмилетнего ребенка. Мои родители тоже за меня никак не заступились. Про аллергию я знать не знала, как и сама подруга. Халву в нее не пихала. Так до сих пор и не пойму — причем здесь Я…   "
"В городе моего детства рядом с пешеходной аллеей стояла избушка на курьих ножках. Именно такая, которую я представляла, читая сказки. Для меня она была окружена загадками и тайнами. Дверь в избушку была закрыта, а через окошки сложно было увидеть что-то внутри — темно было. Однажды мое любопытство получило ответ на вопрос: что же внутри? Избушка оказалась местом распития алкоголя и уборной. В тот день растворились мои ассоциации со сказочным домиком.   "
"Однажды в детстве возвращалась домой из школы. Шла по переходу к трамвайной остановке и считала мелочь, её у меня было ровно на проезд. Бабка-попрошайка перегородила мне дорогу своей рукой со стаканчиком. Мне стало неловко, и я кинула ей все монеты. Домой шла пешком семь километров((   "
"В детстве перед моим 10 Днем рождения умирает бабушка. И как раз в День рождения проходили похороны. Мне не разрешили съездить на кладбище и на прощание в кафе со всеми. Сидела одна в пустой квартире весь день. Только поздно вечером, когда вернулись с кафе родные после прощания, мне торжественно вручили пару конфет. Сейчас понимаю всю ситуацию, но обидно тогда было очень.   "
"В детстве хотел стать археологом и закопал во дворе вставную челюсть деда, чтобы потом перекопать всё обратно и почистить её кисточкой. Конечно, сразу поделился находкой и с самим дедом. После всех лещей как-то отпало желание к профессии))   "
"Мать рано вышла замуж и спихнула меня бабушке. Жили мы бедно, бабушка работала, но зарплаты едва хватало. Из особой роскоши были школьные пирожные с розовой глазурью сверху. Каждый день позволить себе эту сладость я не могла, копила копейки несколько дней и с предвкушением счастья бежала в буфет. На одной из перемен, купив себе порцию радости, меня сбил с ног хулиган из параллели. Я упала, пирожное развалилось. Подняла его и, захлёбываясь слезами, съела. Такой обиды в жизни не испытывала.   "
"До средней школы не понимала понятия ""первый снег"". Какой же он первый, если в прошлом году был точно такой же? Первый — это самый первый в мире. Поэтому во всех стишках о первом снеге предпочитала думать, что это происходит в древние времена с дремучими людьми, которые никогда снега не видели. Я была совсем не романтичным ребёнком.   "
"В детстве жили в частном доме, держали свиней. В свинарнике была розетка (почему-то розового цвета). Дядя сказал мне, что это свиной пяточек, и, если его трогать, то свинка разломает стену и растопчет меня. Очень долго в это верила и к розеткам лишний раз не подходила.   "
"В детстве я залезла в мамин шкафчик с косметикой, намазала себе кремом лицо, воспользовалась помадой и тенями по примеру взрослых. Довольна собой пошла играть. Через несколько минут почувствовала дикое жжение на лице, но бежать и признаваться маме я не спешила, знала, что опять влетит за использование косметики. Позже мама увидела меня с фиолетово-красным отёкшим лицом и незамедлительно вызвала скорую. Прибывший врач резюмировал ожёг лица первой степени. Так я перестала пользоваться косметикой, пока не научилась отличать жиросжигающий крем с перцем от крема для лица.   "
"Все в детстве мечтали стать космонавтами, врачами, дальнобойщиками. Я же в детстве хотел стать священником.   "
"Когда мне было лет семь, моя подружка рассказала, как она с соседским мальчишкой трахалась; ни я, ни она полного значения этого слова не понимали — думали, что это так, вместе лежать и обниматься, и это слово нельзя говорить взрослым. Однажды мы поругались, я психанула и пошла рассказала ее бабушке, что она трахалась с мальчиком. Хорошо помню бабкино офигевшее выражение лица...    "
"Наткнулась на свой детский рисунок: там была собака с искрами изо рта. И тут я вспомнила, что в детстве видела разные звуки: громкие разговоры людей выглядели серыми грозовыми облаками; в театре на концерте под потолком было северное сияние. У меня была синестезия, но я этого не понимала, думала, что все это видят. Родители, видимо, принимали всё это за детские фантазии. Я когда-то спросила маму, а больно ли собакам, когда они лают. Она не поняла вопроса. Но она-то не видела искры из пасти.   "
"Мама в детстве всегда говорила мне прятать ключи. Мол, любой может сделать слепок из пластилина, залить его воском и сделать ключ на основе восковой копии. Решила проверить. Свечкой капала в пластилин, но он плавился. Плюнула, пошла смотреть телевизор. Чувствую, пахнет гарью. Выхожу из зала, а квартира наполовину в дыму. Забегаю в свою комнату — полыхает диван. Тушила всем, что под руку попалось: компотом, чайным грибом, аквариумом с рыбками. Но как же потом полыхала моя задница от ремня!   "
"В детстве внушили, что необходимо быть крайне осторожным, переходя дорогу, да и просто находясь на улице, дабы не угодить под колёса. Лет до тринадцати жил в полной уверенности, что, каждый водитель намеренно хочет сбить меня. Жил в очень непростой реальности.   "
"Мой отец люто ненавидел советскую власть и советский строй. В четыре года я спросила: ""Папа, а кто такой Ленин?"" Отец, забывшись, сгоряча ляпнул: ""Это тот мудак, из-за которого в нашей стране купить ничего нельзя!"" Через пару дней едем по Ленинскому мимо памятника.  — Пап, а это кто? — Ленин.  Я, звонко, громко, на весь автобус: ""Ааааа, это тот мудак?"" На дворе 1990 год был.   "
"Однажды бабушка спросила пятилетнюю меня: ""А папа маму не бьёт?"" И всё, детство под откос. Я поняла, что, оказывается, такое может быть. На малейший шорох неслась к родителям в комнату. Они смеялись и шутили: ""Книжка упала — сейчас защитница прибежит"". Вот такая семья шутников ребёнку знатно детство подпортила.   "
"Когда я был маленький, любил наблюдать за тем, как бреется папа. Мне всегда казалось, что это столь мужественно и брутально. У меня всегда чесались руки, хотелось испытать, каково это — бриться. Застал в очередной раз отца перед зеркалом с бритвой в руках и напросился хоть немножечко побрить его. Ну, а он, ничего не опасающаяся добрая душа, разрешил. Бритва на тот момент была из острого лезвия — рапира. Взял я её, начал проводить по его щеке и как-то не рассчитал силы, срезав ему часть щеки. Меня трясёт, паника, кровь капает, я бегаю то за ватой, то за газетой, чтобы остановить кровотечение. А отец с полным спокойствием продолжает бриться. Всё это продолжалось, пока не прибежала сестра: отвесила люлей мне, отчитала папу и остановила кровотечение.   "
"Помню, когда я была мелкой и не очень сообразительной, сестра перед экзаминами варила старые тетрадки, вырезала пятерки и говорила, что если я съем эту бумажечку, то буду умной. Сами понимаете, умной быть хотелось...   "
"В детстве украла шоколадный батончик из магазина, пришла домой и очень боялась, что сейчас милиция придёт за мной, и родителей стало жалко. Тогда ничего умнее не придумала, чем распороть медведю задницу, засунуть батончик туда и зашить)   "
"Как-то в детстве ходили с папой по большому рынку с гордым названием ""Меркурий"". Мама сказала нам купить курицу на ужин. Впервые услышав от папы название рынка, мой детский мозг его распознал по-своему. Вот уже 20 лет этот базар в нашей семье называется не иначе как ""Мир курей"".   "
"В детстве спросила отца, откуда у него шрам на ухе. Рассказал историю, что его похитили пираты и заставили носить серьгу, от нее и шрам... То, что он не на мочке, а на верхней части, меня не смутило... Когда выросла, мама сказала правду: это его родная сестра утюгом по голове двинула.   "
"Я помню эту детскую радость. Мокрая трава щекочет ноги, где-то звучат кузнечики, а прохладный воздух целует в щёку. Папа решил, что нужно накосить травы, а мы с бабушкой пошли с ним. Она меня обнимала, мы смотрели на темное небо. Мы смотрели на звёзды и пели, а её руки пахли молоком. Не было ссор, пьянства отца и деда, их драки, вечного запаха алкоголя и рвоты, маминых слёз. Были только запахи молока и скошенной травы.   "
