"В детстве любила гулять с бабушкой. Ходили к ней на работу, в кино, в библиотеку. Но бывало, что по пути куда-то она встречала знакомую, и все. У нас это называлось ""зацепились языком за угол"". Иногда я шла домой одна, если было недалеко. Если домой приходили только я и наша собака, то все знали, что бабушка ""зацепилась"". У нас был очень тихий посёлок и 300+ метров пройти одной к дому было безопасно.   "
"Помню, как шла с мамой за руку и канючила. Она купила целое ведро карамелек с вареньем. Они были розовые, салатовые, полосатые, белые, обсыпанные сахаром, и даже голубые. Мама сказала, что не даст, так как это на бражку. Я понимала, но карамельку... Ну, хоть одну! Она дала парочку раздавленных. Вкуснее этих карамелек я не ела ничего за всю жизнь. Плакала, когда мама бросала их в жбан с брагой. Такие красивые и вкусные, а получается вонючая дрянь непонятно для чего.   "
"Когда мне было пять лет, меня отдали на фигурное катание. Мне купили личные коньки. Лезвия и ботинки были пока ещё не скреплённые. И я, такая важная, ходила по дому в этих ботиночках на каблуках. Как же мне это нравилось — быть на каблуках! Но пришло время, и лезвия прикрутили... И я придумала новый способ: гольфы + баночки с плёнкой от диафильмов внутрь. И вуаля! Я снова на каблуках!   "
"Было мне лет 7-8, и когда заканчивался хлеб, папа мне говорил: ""Доча, покажи, как ты быстро бегаешь — сходи на хлеб-завод за хлебом"". Он неподалёку от нашего дома был — два километра. Я туда и обратно бегом, чтобы показать папе, как я быстро бегаю. Потом весь день нахваливал меня, какая я бегунья. Вот так он всегда меня ""разводил"".   "
Самая жуткая жуть в детстве — это после просмотра фильма «Дрожь земли» идти поздним вечером или ночью несколько десятков метров через огород в деревенский туалет.   
"Наверняка многие помнят рекламу, где мужик ходит по квартирам и ищет грязную одежду, а потом благополучно её отстирывает своим порошком. Поэтому в детстве я всегда чертовски боялся, что он придёт к нам домой, а у нас не окажется очень грязной одежды!   "
"Когда я была маленькой, мой папа ловил мне жвачки из телевизора. Однажды началась реклама, он спросил: ""Хочешь такую же?"" — и сделал вид, будто поймал её, гордо вручил мне. Потом это вошло в привычку. Казалось бы, такая мелочь! А ощущение чуда и счастья осталось.   "
"Когда мне было четыре года, меня зимой папа в садик повёз на санках. Где-то по дороге я выпала, папа не заметил, и я пошла до садика одна. Нянечка из другой группы увидела маленький сугробик, забрала меня, укутала в одеяло и поила какао, администрации сада она не сказала. Папа выследил мои следы, поднял на уши сад и полицию. Домой пришёл через два часа поисков, боялся, что мама ему голову откусит, а я сидела уже дома и мультики смотрела. Больше меня папе не доверяли.   "
"Рано научилась читать. В пять лет, гуляя с родителями, потерялась: увидела что-то интересное и пошла изучать. Заметила лавку с мороженым, поинтересовалась:  — Сколько стоит клубничное мороженое?  Продавец, молодой парень, удивился:  — Где ты его видишь?  — Так вот же,  — я показала на табличку, — написано!  — Если прочитаешь всё, отдам бесплатно.  После того, как я справилась с задачей и получила награду, продавец отвёл меня к милиционеру, а тот — к родителям. Родители в панике, я в мороженом :)   "
"В детстве решила рискнуть — положить 11 булочек в пакет, а продавщице сказать, что 10. Пришла домой, посчитала, получилось девять. Риск — это не мое))))   "
"Я в детстве думала, что кондуктором становится тот, кто первым вошёл в автобус. Представляла: водитель остановился на первой остановке и бежит к дверям, чтобы вручить сумку и аппарат кондуктора первому вошедшему :)   "
"Мне было девять лет. Пропустив занятие в спортивной секции, тренер сказал прийти в другое время в старшую группу. Увидев в окно больших мальчиков, я испугалась и ушла в соседний двор к другим занятиям, но там тоже была старшая группа. Так я и осталась ждать под дверьми полтора часа на улице в мороз -15. Помню, как околела, но зайти так и не решилась.  С тех пор не прохожу мимо одиноко стоящих детей. Детям нужна взрослая защита, взрослая помощь.   "
"В детстве мама решила нас с сестрой дисциплинировать: завела нам тетрадки и за все полезные дела по дому прибавляла нам деньги, за плохое поведение — отнимала. У сестры всё было по мелочи: вытерла выключатель — плюс один, обозвала сестру ""вороной"" — минус один, сходила погулять с собачкой — плюс два, показала язык — минус два. У меня же всё было масштабно: помыла посуду — плюс 10, послала всех в жопу — минус 10, помыла пол — плюс 15, послала опять в задницу — минус 15. Один фиг обе вышли в ноль.   "
"В детстве я была очень весёлая и любопытная. Мама всегда закрывала шкафы так, чтобы я не открыла и не вывалила содержимое. Однажды мама забыла закрыть шкаф, а на самой нижней полке была косметика. Нашла лак для ногтей и начала красить себе стрелки. Чуть-чуть дёрнулась и попала себе в глаз. Такого крика соседи никогда не слышали. Чудом осталась с хорошим зрением, а все благодаря мамочке, которая бросила плиту, на которой готовился обед, прибежала, не растерялась и помогла.   "
"Самое яркое, что я помню из детства, — это как мы с отцом лепим снеговика в деревне. Снега немного ещё, и из-под него торчат засохшие цветы, которые не успели опасть. Я срываю их, и мы делаем снеговику глаза, а из старой кастрюли — шапочку. Ещё нет боли потерь, ещё нет моих косяков с четырнадцати лет. Только бесконечная зима, деревенский уют, тёплый чай и молодые счастливые родители.  Иногда я задумываюсь, где я повернула не туда, и как бы вернуть это ощущение счастья. И ответа, увы, не нахожу.   "
"Лет с пяти спала с топором. Не в обнимку, но тот возле кровати лежал. Красивый, полностью из металла, с узорами по лезвию и ручке. Он был не острый. Эх, любила я его, а потом пропал куда-то. Но в своё время я точно знала, что под моей кроватью не окажется монстров.   "
"В детстве что только не творила: ртутью играла, переливая в ладонях; разливала папин одеколон на линолеум и поджигала; каталась зимой на ногах, вцепившись в бампер машины; прыгала в снег с сарая. Пила из лужи — привет, глисты; а в восьмом классе с пацанами нас оставили убирать кабинет биологии и мы выпили спирт из колбы с лягушкой. Повезло, что это был не формалин и не этиловый спирт.   "
"Была зима, второй класс, 2002 год. На дороге были ужасные накатанные волны, а у меня были очень скользкие сапоги: так вышло, что я именно в них пошла в школу. Я стояла у дороги с огромным рюкзаком около часа и плакала, а до дома было 10 метров. Самостоятельно не могла ее перейти, чтобы не убиться. Помню, как люди видели меня, заплаканную, и проходили мимо. Не знаю, почему я сама к ним не подошла. Только потом, когда уже я сидела у дороги на рюкзаке, ко мне подошёл какой-то дедушка и помог перейти.   "
"Когда мне было три года, мы с родителями пошли первый раз в аквапарк. Были выходные, и народу было очень много. Родителей мне сказали, что, если я потеряюсь, должна подойти к дяде-милиционеру и сказать, что я потерялась, стоять рядом и ждать, когда за мной придут. Я тут же решила проверить свои силы. Выбрав момент, я улизнула от родителей и прямиком пошла к месту, где я видела дядю-милиционера. Подошла, сделала все по инструкции. Когда родители пришли, я просто стояла и улыбалась! Молодец! Смогла!   "
"Я выросла на севере в маленьком городе в Мурманской области. Было у нас в юношестве с друзьями одно излюбленное место — замёрзшее озеро, ограждённое от города неширокой лесополосой. Мы забирались в самый центр по снегу и льду, играли в снежки, смотрели на небо и иногда кричали. Наоравшись, выплеснув плохие эмоции, мы падали в мягкие сугробы и смотрели, как небо из алого становится тёмно-синим, и зажигаются звёзды, искали созвездия и спутники. Одно из самых болезненных воспоминаний прошлого.   "
"Многие в детстве ""крадут"" у родителей украшения. Я придумала кое-что поизощреннее: когда мамы не было дома, я брала её бижутерию/ драгоценности (мне было неважно) и со всей силы кидала на каменную плитку. Так из них ""добывались"" блестящие камушки, которые потом благополучно складывались в носок. План был идеален, но все открылось случайно, когда мама решила перестирать вещи. Попа болела ещё три дня.   "
"Моя мама была художницей, и больше всего на свете я в детстве любила вместе раскрашивать. Когда кончался какой-нибудь цвет, мама говорила, что растения вовсе не обязательно зелёные, они могут быть и красными, если их заливает закатный свет. В комнату может светит луна, и тогда всё будет с голубым оттенком, а у клоунов в цирке просто цветная подсветка. Я красила, а мама рисовала рефлексы и блики. Жаль, что не сохранилось картинок, в моих воспоминаниях они волшебные!  "
"Дело было в раннем детстве. Меня наконец отправили сходить в магазин за хлебом одну! Бежала вприпрыжку, и на полпути случилось непредвиденное — на дороге стоял гвоздь с широкой шляпкой остриём вверх, на который я, собственно, и приземлилась. Проткнул стопу ровно посередине, вошёл сантиметров на 4-5, кровищи было нормально. Но я не могла так просто провалить миссию и с позором вернуться домой, поэтому всё-таки доковыляла до цели и обратно. Мама ругала, а папа хвалил за целеустремленность.   "
"Когда я была совсем маленькая, отец пошёл в парикмахерскую и взял меня с собой. В какой-то момент мне стало скучно, и я решила пойти домой, и ушла. Путь мой лежал почти через весь город, да ещё и через ж/д пути! Пришла домой, и мама спросила: — Где папа? — Там. — сказала я.  Мама решила, что он проводил меня, а сам пошёл по своим делам. Вечер — папы нет, ночь — папы нет. Папа бегал по всему городу, искал меня, подключил всех своих друзей и знакомых, а домой идти боялся.   "
"Когда мне было лет шесть, я безумно хотела почувствовать себя фигуристкой и покататься на коньках. Для этого я взяла соль и рассыпала половину пачки по всей комнате. На коньках покататься у меня, увы, так и не получилось, но зато после я получила неплохих люлей от родителей.   "
"В детстве я настолько редко ела шоколадные конфеты, что после съедала ещё и бумажные обёртки, потому что они пахли шоколадом…   "
"Я до девяти лет была уверена, что секс — это имя. Во времена моего детства на экранах шёл сериал «Секс в большом городе», и там был кадр, как идёт какой-то мужик. Так вот я думала, что сериал про него, про Секса, который оказался в большом городе))   "
"В годы моей юности выпускались всего лишь несколько журналов, пользующихся популярностью у молодёжи — Cool, Cool girl и ещё какой-то, название не помню. Был там раздел ""знакомства"", где публиковались, в основном, подростки от 12 до 17 примерно с указанием адреса проживания, куда писать письма в конверте. Это не чатик в интернете. Помню, как сама пару раз писала парням оттуда и вкладывала ""самую лучшую"" фотку с деревенского отдыха у бабушки, но ни один принц так и не ответил мне)   "
"Самое яркое воспоминание о Пасхе. Мне 5 лет. Солнце, тепло, ветерок. Отпрашиваюсь у мамы на улицу смотреть, как катают яйца. Без куртки в красивой красной кофте, ситцевом платье и съезжающих колготках радостно топаю в сандаликах по песку, специально насыпанному для соревнований. Яйца все разные. Крашеные луковой шелухой, зелёнкой, кастелланью, свёклой, морковкой и даже анилиновыми красками. Игроки в азарте. Ставят яйца, монетки. И посреди всей этой радостной суеты в воздухе парит жёлтая бабочка.   "
"Как-то родители оставили меня в машине и, чтобы я не скучала, дали жвачку Стиморол. Ждала их долго и потихоньку сжевала почти всю. Осталась последняя, и я решила её вначале просто подержать во рту, так как она была сладкая. Очень удивилась, когда после этого она из белой стала золотистой! В это время у Стиморол как раз был конкурс: нужно было найти золотую подушечку и получить приз! К сожалению, моего детского терпения не хватило, и я её сжевала. И потом мне никто не поверил.   "
"Все так озадачены воспитанием будущего поколения, цензурой там и сям... А я вспомнила на днях популярную считалку из своего детства: «Рыжий-рыжий конопатый убил дедушку лопатой. Буду резать, буду бить, все равно тебе водить». Мне теперь искренне интересно, как мы после этого массово маньяками и серийными убийцами не стали. :))   "
"Я в восемь лет вышла замуж. Лето, любовь, все дела. Девчонки постарше решили организовать свадьбу, пока родителей не было дома. Самая старшая даже приготовила пюре с укропом, раздобыли кассету с маршем Мендельсона. Мой «муж» выпросил у бабули 15 рублей и купил мне пластмассовое кольцо. Я надела своё лучшее платье с бантиками. Собрали всех друзей со двора, включили марш, подружка произнесла речь, и вдруг зашла мама. Ох и люлей я тогда отхватила. Брак наш развалился.   "
"В детстве родители не могли шлёпать меня по попе, потому что я сразу падала на жопу, крепко прижимая к полу, и прикрывала её драгоценную руками. Я верещала со всей силы, пугая соседей и людей на улице. По той же причине мне не могли ставить уколы))   "
"Детский сад, мне пять лет. Все мы встали, воспитательница велит идти мыть руки, мол, сейчас пойдём кушать. Туалет находился в классе, после ещё раздевалка, а столовая далеко по коридору в противоположном конце здания. Всё маленькое стадо бегом кое-как сполоснуло и выбежало, я же, а-ля хорошая девочка, мою, как учили — с мылом, тщательно. Выхожу — никого. Иду к дверям — закрыто. Крики, слёзы, большая закрытая дверь и никого. Нашли меня забитую под столом, и в сад я больше не ходила.   "
"В начальной школе меня сочли туповатой, когда я не смогла показать север, юг, запад и восток. Вот спрашивает меня учитель показать в классе где что, но как же без компаса-то? И мох не растёт. Она объясняет, что если север в ту сторону, куда я смотрю, то где остальные. А я стою и молчу. Молчу и думаю: ведь если рассуждать логически, я повернусь на 180 градусов, и стороны поменяются местами. Где же компас или хотя бы мох…   "
"На посиделках с родственниками папа рассказывал про утренники младшего брата и потом вспомнил историю из моего детства. Что я мелкой возмущалась «почему мы делаем эти все постановки, глупые танцы, это скучно всем: и детям, и взрослым». Я послушала его и сейчас бы изменила только слово «почему» на «нахера».   "
"Когда был малой, любил играть с огнём, спички мне тогда не давали, а остановить не смогли. У меня была лупа, и я быстро понял, как её использовать. Я делал узоры на скамейках, но в один день я нашёл бумагу, которая не тлела, а загоралась. Закончилось всё тем, что мы с друзьями в детском саду собрали солому от веника и сделали костёр. Дети в восторге, я доволен как конь, а у воспитателей шок. К счастью, все отнеслись к этому с юмором.   "
