"В универе училась очно на бюджете, все четыре года работала. Получала 50/50 тройки и четверки, а курсовые, контрольные и диплом писала сама, на пять. Мама понимала, что своим заработком я помогаю нам выжить после смерти отца, хвалила. Ругала меня за оценки только бабушка по линии отца, за глаза позорила мою маму, мол, такая же двоечница, как я. После смерти бабушки я разбирала документы, нашла ее аттестат зрелости и бухгалтерские курсы — по всем предметам у нее три. К чему это лицемерие…   "
"Когда нужно пить лекарства, бабушка всё время произносит: ""Пора трахнуть таблеточку"". И не понимает, почему я ржу и прошу больше так не говорить.   "
"В детстве меня ""отравила"" собственная бабушка. Мне и года не было, как она под шумок решила дать мне кусок арбуза не первой свежести. Как итог: отравление, но оказалось, что ещё и аллергия. Я вся опухла, рвало — еле откачали. На резонный вопрос ""зачем она это сделала"", ответом было: ""Взрослая же, не умерла бы"".   "
"Шла вечером домой, начинался дождь, я без зонта. Подхожу к своему перекрёстку, и окликает бабуля, мол, переведи через дорогу. ""Не вопрос, ба, пошли"". По ту сторону дороги просит довести до конца дома — довела.  — А вон до того столба.  — Ну, ок, раз уж начала, пойдёмте.  — А вот до того дуба.  Я уже из принципа веду её, куда скажет, хотя злюсь и промокла.  На очередной её ориентир психую, спрашиваю, где конкретно находится её дом. Ответ убил: ""Так мы же прогуливаемся просто!""   "
"Дело было зимой, сижу на кухне, сетую своей бабуле, что холодно, шубу хочу, а денег нет. На что ба отвечает, мол, не волнуйся, через пару дней поедем покупать. Я в шоке говорю: ""Ба, на твою пенсию у меня совести не хватит, только если тебе любовник деньги не отправит"". Хотела пошутить, но по взгляду ба я поняла, что угадала! Оказывается, у неё есть ухажёр, который каждый месяц перечисляет ей деньги на расходы! Моей ба 78 лет! Я в шоке!   "
"Вот уже на протяжении десяти лет, раз в две недели, моя бабушка собирается помирать: зовёт к себе, прощается, просит прощения, жалуется на жизнь и то, какие мы все дураки. Слезливо так, будто искренне. Но, наблюдая этот концерт год за годом, в такие моменты хочется так грубо у неё спросить: ""Да что ж ты так долго собираешься?!"" В остальное время — адекватный человек, которому ещё жить и жить.   "
"Идём с подругой, перед нами нерегулируемый пешеходный переход. Видим, что едет автобус, и решаем подождать, а потом переходить. С противоположной стороны перехода подходит бабка и решает перебежать. Перебегает и выкрикивает нам: ""Вот даже бабка перебежала, а вы стоите"". Крикнула ей вслед: ""Так вас не жалко, если собьёт, а мы ещё молодые!""   "
"Возле нашего университета крутились черные собаки, я их подкармливала. Небольшая стайка самых ласковых частенько провожала меня до дома. Иду так однажды с пар, рядом чапает моё хвостатое войско, и краем глаза замечаю перекрестившуюся с гримасой ужаса на лице бабулю. Поворачиваю голову в ее сторону, и в меня летят плевок, брань и проклятия. Старушку напугал мой нефорской прикид, а антураж в виде шести здоровых угольно-черных псин добил окончательно. Так я стала ""шлюхой сатаны"".   "
"Я поняла, что окончательно постарела. Иду по улице, дети на ветке прыгают и пытаются сломать, а она аж трещит, бедная. Остановилась и начала им морали читать, про то, что дерево росло, не вы его сажали, нечего его ломать и шли бы вы на площадку. А мне всего-то 25 лет.   "
"Мне было лет 10, я сидела у бабушки на кухне, болтала с ней о всяком. Внезапно она не перестала помешивать в лук и сказала, что на самом деле я не папина дочь. Она все высчитала, его не было в городе в это время, и я не могла у него родиться. Пока я сидела и хватала воздух ртом, она успокоила меня, сказав, что они меня все равно любят и относятся, как к родной. Никогда не забуду взгляд папы, когда он за обедом застыл с ложкой у рта при этом рассказе, он тоже, видимо, был не в курсе.   "
"Моя бабушка — красавица, за ней ухаживал красавец-моряк. А она нравилась моему деду. Бабушка как-то шла с танцев, и дед ее изнасиловал. Это был позор, и ей пришлось выйти за него замуж. Она его ненавидела: он пил, орал, однажды вообще привел любовницу домой, когда моя мама была подростком. Он умер. Моя бабушка пережила его на 10 лет. За это время ни разу на могилу не съездили. А фотография того моряка до сих пор хранится в нашем фотоальбоме.   "
"По случаю Дня рождения бабушки выставила её фотографию со времён молодости в Инстаграм. Эта фотография стала более популярна, чем мои ""себяшки"". Я хотела подбодрить свою бабулю и сказала ей об этом. На что она мне ответила: ""Тань, ты, конечно, извини, но я была намного красивее тебя"". Мне её самоуверенность, к сожалению, не перешла по наследству.   "
"Встречалась с парнем четыре года. Бабушка была против этих отношений: он дважды со мной расставался, но я очень к нему привыкла, оба раза удавалось помириться. Сделал предложение, я обрадовалась, а бабушка попросила не выходить за него и расстаться, взамен обещала подарить свою квартиру. Я подумала и решила, что отношения наши не так уж и надёжны — рассталась с парнем. Приехала к бабушке, а она сказала, что квартиру не даст, мол, я ей ещё и должна — спасла меня от плохого брака.   "
"Бабушка пятнадцать лет живёт в нашей квартире, в моей комнате. Ковёр на стене вместо плакатов, гжель в шкафу вместо игрушек. Никакого личного пространства, бабуля всё делала по своему вкусу. При том, что у неё своя квартира, которую она сдаёт, она считает мою комнатку своей. И без зазрения совести ругала за лишнюю потраченную каплю воды, хотя платила за счётчик мама. Деньгами от сдачи она не делилась, хотя и на еду не скидывалась. Теперь говорит, мол, иди снимай квартиру, взрослая уже. Мне 17 лет.   "
"В давние студенческие годы отправили в колхоз. Возвращались с работы мимо сельских домов, окрикнула древняя бабуля с просьбой помочь дров наколоть; помогли. Пригласила за стол на вареники в знак благодарности. Мы — пятеро голодных студентов, — конечно же, согласились. Бабуля говорит: ""Рябят, вам вареники прусканные или непрусканные?"" Мы переглянулись, хз... Непрусканные — значит, обычные. Давай прусканные. Она набрала в рот сметаны и прусканула на вареники. Никто так и не оценил этот шедевр кулинарии.   "
"Ходили поздравлять бабулю с днём рождения. Настало время чая с тортом, бабуля ушла на кухню делать чай, и тут она высовывается из дверей и кричит нам: ""Девчата, вы чай обычный будете или с АРМАГЕДДОНОМ?"" Для тех, кто не понял, армагеддон — это бергамот)))   "
"Я левша, и это очень волновало бабушку-соседку. Она вечно высказывала моей маме, что меня надо переучить, иначе будет худо, что я неправильная.  Лет в 12 зимой, возвращаясь домой со школы, я почувствовала удар в руку. Эта бабушка напала на меня с палкой и кричала, что из-за таких как я, безбожников, был развален Союз и ещё много гадостей. Чудом я смогла убежать, рассказала маме, но мне не поверили, только отругали за ""враньё"". Эта бабушка через несколько лет умерла, и я рада.   "
"Бабушке с дедушкой по 70 лет, доход на двоих у них под 80 тысяч в месяц, плюс много вкладов и сбережений. На окончание универа подарили мне 50 тысяч, хотя я работаю и говорила сто раз, что деньги не нужны. При этом бабушка экономит на лекарствах. Если покупает таблетки рублей за 400-500, то пьет их очень редко — экономит — как следствие, от них толку ноль. Пробовала сама ей покупать дорогие — откладывает их, потому что жалко, и пьет дешевку, а потом жалуется, что работают они плохо.   "
"Пьём чай с бабушкой, она, углубляясь в свой рассказ, ведает о моем прапрадедушке, вспоминая его черты лица, пухлые губы... И потом говорит: «Так вот ты в него и пошла — губы тоже пухлые», — пару секунд помолчав, добавляет: «А, так ты ж свои накачала, но все равно в него».   "
"На остановке моя бабушка ждала подружку. Рядом стоял крутой электровелосипед. Спустя 20 минут хозяин не явился. Пришла подруга, и они собирались уходить. Бабушка говорит, что она не может уйти, вдруг кто-то украдёт его. Подруга говорит: ""Так забирай, чтобы другой не взял"". Бабушка оставила свой номер у продавщицы магазина, если хозяин будет искать, и уехала на нём. За всё время никто не позвонил. Потом она узнала цену этого велосипеда и очень испугалась. Зато, по её словам, никто чужой не взял))   "
"В начальной школе часто заходила к подруге перед уроками, учились в одном классе, вместе шли на занятия. Ее милая бабушка всегда звала к столу обедать, я вежливо отказывалась, и ждала подругу в комнате, пока она поест. Однажды меня уговаривали особенно сильно, и я согласилась. На следующий день подруга просит больше не приходить, ""бабушка сказала, ты нас объедаешь"". До сих пор обидно.   "
"Бабушка всегда была двуличной. Могла обласкать, а потом за глаза наговорить про тебя гадостей. Самым страшным для нее было, что обложенный говном человек узнает, что она про него говорила. Когда эта хрень коснулась моего мужа, я начала с улыбкой отвечать: ""Хорошо, бабуль, я так ему и передам"". Сначала были визги, что мне никто не поверит, потом обиды и бойкот. Знаю, что человека не изменить, но она хоть мне перестала гадости про других рассказывать.   "
"В детстве увидела в мультике, как у одного из персонажей болело горло, а потом ему удалили гланды, после чего ему давали много мороженого. Тут же в моей головешке созрел план, и я уже предвкушала килограммы вкусного мороженого. Подошла к бабушке с заявлением: ""У меня болит горло кхе-кхе, наверное, надо удалять гланды"". После чего бабушка сказала: ""Ишь, что выдумала, вырастешь — удаляй хоть жопу."" Отварила картошки и заставила дышать.   "
"Я замужем. На днях соседка через дорогу (ей примерно 65 лет) спросила меня: ""Почему вы вечером зашториваете окна? Я не вижу, чем вы там занимаетесь!"". Я была в шоке от такого вопроса и просто прошла мимо. Вечером рассказала мужу про любознательную бабульку. Он посмеялся, пошел разделся и одернул занавески. Так и ходил по дому голенький, несмотря на мои претензии. Больше наша бабулька ничего не спрашивала, только загадочно улыбается моему мужу…   "
"Хочу быть идеальной бабушкой. К этому есть все предпосылки: умею и люблю вязать носки, печь вкусные пироги, гладить по голове и пахнуть нафталином.   "
"Стояла в очереди на кассе супермаркета, позади меня пристроилась бабуля-божий одуванчик. Долго и пристально на меня смотрела и говорит мне, мол, ты молодец. Я, ничего не понимая, уточняю, в чём именно я молодец. ""Молодец, что косу носишь, а не растрёпанная и лохматая ходишь. Ведь все девки, кто не собрают волосы — ведьмы. И их надо сжигать"". Я поулыбалась и поскорее от нее отошла. Из-за своей лени я не вымыла утром голову и избежала инквизиции в глазах бабули)))   "
"Когда я была маленькая, у бабушки на даче был огромный огород, где росло очень много разных ягод. И она заставляла меня их есть тазиками: полезно, натурально, витамины, зимой свежих не будет. Пока не доем, гулять не пойду. Мне 33, я до сих пор не могу смотреть на клубнику, смородину, малину, вишню, сливу, яблоки. Единственная радость — черешня. Какое счастье, что хоть её не было на бабушкином огороде!   "
"Как-то охранники рассказывали. Работали в агрофирме — охраняли поля — и поймали бабульку с мешком кукурузы. Все ее попытки их разжалобить заканчивались фиаско, пока она не сказала, что стырила всего два мешочка, а поймали-то с одним. Послали ее за вторым. Короче, надурила их бабулька, убежала от них в кукурузе.   "
"Ко мне в электричке подсела бабушка и рассказала, что Цукерберга хотят сместить с поста главы компании фейсбук, травила шутки про пенсионную реформу. Вот бы всем такими быть в старости.   "
"У моей бабули очень много разных красивых сервизов, наборов посуды. Она каждую неделю выбирает один из наборов и кушает из этой посуды, пьёт чай, кофе. И считает, что посуду она покупала не для того, чтобы смотреть на нее. И нас всех к этому приучает.   "
"На днях купила продуктов мешок, решила зайти в магазин посмотреть нижнее белье. Сумку поставила на пол между ног и разговариваю с продавцом, прошу модели показать. Заходит на вид приличная бабка, покупает что-то, уходит. Я смотрю под ноги, а моей сумки нет! Выбегаю на улицу, бабки нет нигде — ни в ближайших дворах, ни магазинах... Вот мне интересно: куда за две минуты могла деться бабка лет 70 с тремя тяжёлыми пакетами; и с какой скоростью она бегает...   "
"Бабушка парня уже который раз передаёт мне гостинцы в виде редиски и зелени. А недавно она прислала ему какой-то странный бальзам. Почитав этикетку, поняли, что он для повышения сексуальной активности. Кажется, бабушка серьёзно настроена сделать нас здоровыми и счастливыми :)   "
"Временно подрабатываю в печати фотографий. Приходит вчера бабушка, на вид лет 70, просит распечатать фотку с внуком с флешки, а на ней ещё 100 фотографий, о которых она, видимо, не догадывалась, потому что удивилась, увидев их на флешке. Стали смотреть вместе, чтобы она поняла, что это. После фотографий с бонгом, травой, алкоголем, презервативами и другими бабушками в бикини возле бассейна, она облегченно вздохнула: «А, так это мой день рождения, месяц назад отмечали. А фотка с внуком вот».   "
"Каждое лето приезжала к бабушке в деревню. Люблю свою бабушку, её давно уже нет с нами, но один случай врезался в память. Ранним утром шла с тяпкой грядки полоть и увидела ежа, разрубленного лопатой. Я в рев и в слёзы — бегу к бабушке. А она победно произносит: ""А, это я его убила. Ежи таскают цыплят"". Я в истерике иду хоронить ежа и рассказываю бабушке, что ежи селятся в местах, где много змей, а цыплят таскает любимая кошка бабушки.   "
"Моя бабушка на моей свадьбе сказала тост, а в конце добавила: ""Ты у меня такая красавица, глядишь — может, и лучше жониха найдёшь"". Спихнули бабушкин фейл на старческий маразм, но муж сильно обиделся.   "
"Мы с сестрой были детьми, соседке было за 60, сухонькая, маленькая старушка. Дело было зимой, когда соседка решила выйти покурить на балкон ранним утром. Балконная дверь захлопнулась, и, видимо, боясь околеть от холода, она не нашла идеи лучше, чем перемахнуть к нам на балкон. Расстояние всего шаг, но 23 этаж! Сестра проснулась от стука в окно, они тихо нашли дубликат ключей, и никто даже не проснулся! Утром сестре никто не поверил, все смеялись и говорили приснилось, пока не пришла соседка.   "
