"От нашей бабушки мы никогда не слышали ругательств, но однажды, зайдя на кухню, я услышала слова бабушки адресованные коту: ""Ты что, ублюда, сидишь, ничего не ешь?"". Я встала как вкопанная, вылупив глаза на бабушку, и спросила чем кот перед ней провинился. Она расхохоталась и говорит: ""Да нет же! Кот У БЛЮДА уже второй час медитирует, ждёт чего-то повкуснее!""      "
"Иду по улице, пью разливной квас из прозрачной бутылки, а он очень на темное пиво похож с виду. Мимо проходит бабуля и причитает: ""Вот, всякой гадостью себя травит"". Я ей в ответ, предвкушая лекцию о вреде алкоголя: ""Вообще-то это квас! "" Она сразу заулыбалась и вся такая милая: ""Ой, а я думала, что кока-кола!""   "
"На мою бабушку последние четыре года навалились болячки. Одна за другой. Сначала она сломала плечо, потом рак груди, инфаркт, замена подвздошной артерии, на очереди удаление образования в надпочечнике. Она очень устала от больниц каждые полгода. Но она не унывает. Называет себя бабушка-трансформер, как в песне Слепакова)) Челюсть вставная, сиська отстегивается, в сердце трубка, в ноге трубка)   "
"У родителей есть великовозрастная соседка, одинокая совсем. Жалко ее, вот и помогают как могут. Вздумалось весной старушке платье сшить, на последний ход, так сказать. Везите, говорит, меня в лучшее ателье. Через месяц готово платье. Но ох как досталось портному с примерками: то длину убери, то талию подчеркни, то ткань нужна понарядней. Сшили красиво, по сезону и размеру. Выдохнули. Вчера приходит и заявляет, что надо шить новое платье! Вдруг в феврале помрет, а в летнем платье неприлично!   "
"Работаю в отделе косметики. Сегодня приходила бабуля и игриво заявила: ""Девушка, мне бы... Помаду. Стариков соблазнять!""      "
"Будучи студенткой, снимала комнату в квартире с хозяйкой. Это была бабушка около 70 лет, очень бойкая и довольно подвижная. Сначала думала, что будет как обычно постоянное бухтение, недовольство и пр. Но за два года я поняла насколько это хороший человек! Мы ни разу не поругались, вместе ужинали и по праздникам она всегда меня приглашала к себе за стол, могла выслушать и дать совет. Общаемся и ходим в гости до сих пор. В общем, я не думала, что смогу найти себе 70-летнюю подругу! :)   "
"У нас в подъезде живет бабулька. Ей уже далеко за 80 и она всех ненавидит. Сядет у подъезда, закурит сигаретку и материт всех, то проститутки все, да чтоб все сдохли и т. д. Сегодня иду на работу, она идет на встречу. Я ей говорю: ""Доброе утро, баб Кать"". Она мило улыбается и отвечает: ""Доброе утро!"" И не успеваю я и шага мимо пройти, как она добавляет: ""скотина!""   "
"В детстве у бабушки в серванте стояла кофемолка с ручкой в виде белочки, так мы с братом постоянно покушались на эту белочку, а бабушка никогда не разрешала, кинув как-то фразу: ""Вот умру, тогда и покрутите"". Однажды брат неожиданно спросил: ""Бабушка, когда ты уже умрешь?"", она в шоке: ""А что такое?"" - ""Да белочку хотим покрутить!""   "
"У нашей бабушки четверо внуков (27, 16, 9 и 8 лет). Сейчас бабушке 65 лет и она со всеми нами делала и делает уроки на всех этапах школьной программы, она умеет вычислять коэффициенты, решать сложные уравнения, готовить к ЕГЭ, одновременно с другим внуком учить английский и ставить правильное произношение, показывать опыты по химии и физике, биологии, разбирать формулы, печь пирожки и блинчики. Уникальный человек! Вот что значит два высших образования в советское время.   "
"Начало 90-х, мама урвала для меня шикарный летний сарафан с многоярусным, ступенчатым подолом. В этом сарафане оставила меня на пару часов у бабушки, когда вернулась не поверила своим глазам. Бабушка, чтобы спасти ребёнка от жары, отрезала все ярусы у сарафана.   "
"Одно из моих сокровищ - носки. Шерстяные. Их вязала прабабушка более 20 лет назад. У нее было 6 детей, 15 внуков, более 30 правнуков. Я никогда ее не видела, но на каждый новый год она присылала нашей семье посылку с носками, 4 пары: мне, брату, маме и папе. Всем своим внукам, их супругам и правнукам. 60 пар носков)) Чтобы мы не замерзли холодной зимой. Ей было 94, когда она умерла, а мне 14. Последние носочки я берегу как память о тепле ее рук и души.   "
"Сейчас вспомнила почему-то Ее. Когда я была подростком, моя покойная бабушка рассказывала мне о своих былых путешествиях. Как она жила в Эфиопии и у неё была служанка, как в Индии она заснула на важных переговорах и захрапела, как делают лепешки в Намибии, про тропические ливни, как они с дедом разругались в Египте, а потом он катал ее на верблюде. Много всяких историй. Каждый раз я слушала эти истории, открыв рот, и мечтала хоть одним глазком увидеть этот мир.   "
"В этом году поступила в универ. В порыве ностальгии полезла в шкаф за альбомом с детскими фотками. Обратила внимание на дурацкую рамку: там фотка меня семилетней. Решила вытащить фотку из рамки и куда-нибудь убрать. Что и сделала. А в рамке что-то осталось. Оказалось, 300 рублей свежепечатанными 50-рублёвыми купюрами. Мама посмотрела на это и говорит: ""Так только наша бабуля старенькая сделать могла. Ей всегда пенсию приносили такими купюрами. Вот это тебе от неё подарок за поступление. Не зря же ты эту рамку именно сейчас нашла."" Сижу и реву, бабули не стало 3 года назад.   "
"Бабушка решила, что раз уж я встречаюсь с парнем, то надо меня просветить на тему контрацепции и секса. Посоветовала вешать на спинку кровати маленькую сумочку, в которой будет платок или марля — после соития срам вытереть. Дескать, удобно и постирать потом можно.  Спасибо, ба, совет отменный...   "
"Когда мои родители поженились и мама переехала к отцу, ее невзлюбила бабка-соседка и назвала корову ее именем. Каждый вечер на всю улицу неслось: ""Наааааадя! Нааааадя! Гребаная проститутка! Быстро домой! Наааааадя!""   "
"Пришла я однажды домой, и вижу картину маслом, за компьютером сидит моя бабушка, причем не просто сидит и тупо смотрит в экран, а пишет что-то моему другу, который мне нравится. Спрашиваю у бабушки, что это такое, а она мне выдает: ""Ты же оставила компьютер включенным, он сильно гудел и я не могла уснуть, и я решила его выключить, а тут бац и сообщение: ""Привет, киска моя"", я решила пообщаться с мальчиком"" На мой вопрос, что дальше бабушка сказала, что я ему нравлюсь, и что завтра мы идем в кино.   "
"Родители и дедушка погибли в авиакатастрофе, мне было 10. Бабушка (тогда ей было 49) взяла надо мной опекунство, воспитывала, давала мне все-все. А я ругалась с ней, постоянные закидоны и претензии. Она всегда улыбалась и ни разу не подняла на меня руку, хотя поводы были. И вот на выпускном, стоя на сцене, меня как озарило. Я вдруг поняла через КАКУЮ боль она прошла и ЧТО она для меня значит. И сейчас когда мне спрашивают ""как же ты без мамы""... Я с мамой, мы вместе и мы справились.   "
"Еду в автобусе, на одной из остановок заходят две бабули-одуванчика. Очень миловидные, оживленно обсуждают дачу и всякую всячину, разговор заходит о том, где одна из них будет выходить. Так вот она собеседнице отвечает: ""Я с тобой сойду, мне, простите..."" - окинув виноватым взглядом окружающих, ""... все равно нех*й делать"".   "
"Понадобилось мне тут прикупить тыкву. В магазине продают только нарезанные, посему отправилась я на рынок. Подхожу к ряду бабулек, выбрала симпатичную такую тыковку у одной. Пока бабулька мне тыкву взвешивала да в пакет засовывала, стала делиться со мной рецептом какой-то умопомрачительной тыквенной каши. Я с дуру и говорю: ""Да мне не на кашу"". Что тут началось! Бабка отбирает у меня тыкву и орет, что я, дескать, вырежу ""из тыквы чёрта и буду проводить ритуалы черной магии, а она не хочет, чтобы выращенная ею тыква была в чем-то подобном замешана"". И все бабки на рынке мне отказались продавать тыкву( Пришлось катить на другой рынок.   "
"Стою, значит, я в салоне сотовой связи, разговариваю с продавцом-консультантом. Тут подходит бабуля лет 75 и начинает в наглую, очень грубо лезть в разговор, меня перебивать и просить консультанта закинуть ей деньги на счёт через терминал, мол она не умеет. Девушке ничего не оставалось делать, как помочь. Вначале я стояла в шоке, а потом набралось смелости и сказала ей: Бабушка, я, конечно, старость уважаю, но так наглеть тоже нельзя"". На что она мне говорит:""Меня уважать не надо. Ты, су**ка, тут до утра будешь стоять пи*деть, а мне щас надо"".   "
"Когда дочери исполнилось полгода, приехали ко мне в гости мои бабушка с дедушкой. Ну, все с правнучкой занимаются, агукают, смешат её, ну милота сплошная. Ну, посидели за столом, всё хорошо, и тут бабуля моя говорит, что хочет с правнучкой погулять пойти. А бабушка моя по жизни человек очень наивный и верит всему, что ей скажут. Ну и папа мой ей говорит: "" А у тебя есть права на вождение коляски? "" Бабушка глаза вытаращила: "" А разве надо? Я с вами просто гуляла и всё. Как сейчас сложно -то..""   "
"Муж выходит из лифта на первый этаж. У почтовых ящиков стоит соседка преклонного возраста, попросту - бабка. И вышвыривает рекламу из своего ящика прямо на пол. Муж сделал ей замечание: ""Вы дома у себя тоже мусор прямо на пол бросаете?"" Та отвечает: ""Ты тут самый умный что ли? Иди учи свою пизду щи варить!"" У мужа челюсть отвисла. А потом такие возмущаются, почему молодежь наглая. А кто воспитал, с тех пример и берем..   "
"Когда я была подростком, бабушка очень боялась, что я пойду по кривой дорожке, всё время меня контролировала и подозревала во всех смертных грехах.  Я у неё лет с 11 вечно была то наркоманкой (от супа отказалась - наверное, от наркотиков аппетит пропал), то проституткой (плохо себя чувствует - залетела, наверное), а уж если она не могла что-нибудь найти (хоть трусы, хоть очки) - вообще никаких сомнений быть не могло: это я украла.  Родители это видели, но ничего не делали - это ж бабушка от заботы так делает, радоваться надо, что ей не всё равно. Поступив в институт, я свалила в общагу и домой старалась приезжать пореже, что при таком отношении неудивительно. Бабушка начала активно общаться с моей троюродной сестрой и благополучно не замечала, что та и травку покуривает, и её единственные серёжки в ломбард сдала, и купюры из конверта с пенсией подворовывает. Когда всё открылось и сестра призналась, виновата всё равно оказалась я: почему не предупредила (из другого города за триста км, ага!)?!   "
"С уважением отношусь к пожилым, но это просто ад! Не пойму, почему бабульки считают своим долгом сделать замечание касаемо ребенка. Одна прям догнала и наорала, что у меня ребенок в коляске задохнется, а я просто подняла верх от ветра. В поликлинике одна привязалась, что нельзя с ребенком ласково разговаривать - нюней вырастет. Моей малышке 7 месяцев. Но пиком терпения стало когда подошла бабка и вытащила у моего ребенка соску изо рта и кинула в кусты. Вредно якобы. Еле ноги от нее унесли. Как же достали.   "
"Я работаю в магазине продавцом. Пока консультировала покупателей, заметила бабулю разглядывающую ажурные стринги. Подумала, что хочет внучке подарок сделать. Спрашиваю: ""Вам какой размер?"", а она: ""Мне себе надобно. Деда соседка увела, стерва!"" Подобрали бабуле стринги) Однако, даже в таком возрасте ещё не всё потеряно;)   "
"В очередной раз моя бабушка водилась с двоюродным братом, которому на тот момент было примерно 2-2, 5 года. Не желая пропускать передачу ""Давай поженимся"", бабушка посадила братика рядом с собой, напротив телевизора, дала ему в руки кубики-конструктор и принялась смотреть данную программу. В какой-то момент она настолько забылась и возмутилась происходящему в передаче, что в слух, громко и отчетливо, глядя на какую-то невесту программы, произнесла: ""Корова, блять!"". В этот же момент двоюродный братик замер с кубиками в руках, посмотрел на бабушку, затем на телевизор, после чего, так же громко и с выражением, поддержал бабушку, выдав: ""Му-му, блять!""   "
"Сегодня встала с кровати, и резко упала. Вдруг в комнату заходит бабушка и спрашивает: ""Внученька, ты что ль отжиматься решила. Так ты не правильно делаешь. Смотри как надо."" Она резко легла и сделала полностью где-то 20 отжиманий. Теперь я её боюсь.   "
"Бабуля у меня кремень. В больницы не любительница, но на даче лазая в кустах малины наколола лицо. Пошло раздражение, краснота и все такое прочее. Пошла она к дерматологу, подходит её очередь, она открывает дверь и на полпути её останавливает голос врача, кричащего мед сестре: ""Да у неё ро́жа"" (заболевание). Бабуля моя, в силу своей не сильной образованности и не подозревала, что это болячка так называется и выдаёт доктору (тоже не тихо): ""Да на свою рожу посмотри, хряк"" и гордо ушла.   "
"У меня забит рукав (тату на всю руку). Спокойно шёл по городу, остановился на светофоре и вижу пристальный взгляд бабульки. Ну, думаю, сейчас будет думать о том, что я наркоман и прочее, все по шаблону и старым стереотипам. Тут она ко мне подходит и спрашивает: ""Эта хрень смывается?"" Дальше на мой ответ последовали слова: ""Молодец, отрывайся пока молод, а то потом вспоминать нечего будет"" Шаблон сломлен. Улыбка была до ушей.   "
"Оставили как-то у бабушки моего брата на пару недель. А он маленький и шустрый. Надо было бабушке на рынок. Ну не оставлять же малого дома одного, взяла с собой. Не успели зайти на рынок, как он вырвался и побежал в толпу людей, а бабуля угнаться не может и кричит: ""Люди, держите!"" К счастью один мужчина поймал сорванца. Следующий их выход из дома выглядел так: идет бабушка, а около нее на привязи бегает ребенок. Она обмотала себя веревкой и привязала к себе моего брата. Не сопротивлялся.      "
"Сегодня утром меня через дорогу перевела бабушка. Не я её - она меня! От автобусной остановки до зебры было далеко, я опаздывала и решила перебежать в неположенном месте. И тут нарисовалась весёлая шустрая бабулечка и говорит: ""Сейчас перейдём, знаешь, как я делаю? Руку поднимаю и говорю всем ""Стойте!"", вот так"" Так и пошли: она в позе супергероя и я рядышком.   "
"Бабушка, простая сельская женщина, застукала деда и сына за просмотром эротических фото на компьютере. Спросила:  - А чё это вы тут делаете?  - Э... Дык... Интернет... Смотрим...  - Ой, у нас этого интернету две кассеты дома - заявила бабуля.   "
