"Моей бабуле 87. Сервизу, который она мне подарила, 35 лет. Немецкий. Для меня берегла. В нем овердохера предметов, включая супницу и солонки. На нем ужасные бордовые цветы и золотая каемка (в 80х это было супербогато), в посудомойке мыть нельзя. Занимает большой шкафчик.  Зато в 80х мои родители ели из глиняной посуды цвета свежего поноса. А сервиз бабуля хранила внученьке (мне) на приданое. Хранить нельзя выкинуть — эта внутренняя борьба заставляет кипеть мой мозг. Дочки у меня нет. Подарю снохе через 20 лет.   "
"Однажды моя соседка вместе со своей дочерью и мамой прогуливались в парке, к ним подошла цыганка, стала клянчить денег, а после отказа показала пальцем на дочь и сказала, что та умирает. Цыганку отогнали, на следующий день здоровый подросток внезапно падает в обморок, скорая, больница, врачи говорят, что опухоль и надо срочно удалять. Бабушка кидается в парк, находит цыганку, та обещает ""заговорить"" болезнь и требует определенную сумму денег.  Мать продает машину, бабушка продает гараж, ложатся спать, чтобы утром пойти к цыганке лечиться. Ночью мать встает, собирает дочь, забирает все деньги и уезжает в соседний город в частную клинику, где дочь сразу же кладут на операцию, после чего еще почти месяц проводят восстановительные процедуры.  Сейчас та девочка уже заканчивает университет, а ее бабушка до сих пор с ними не разговаривает, потому что нужно было идти к цыганке, и врачи все шарлатаны!   "
"Моя бабуля жила с нами до моих 15 лет, из них около 10 она болела и почти не выходила из дома. Мы с ней часто придумывали настольные игры: карты (видов семь), пасьянсы, звёздный час, поле чудес. Читала нам с братом сказки, а когда стали постарше, детективы Дойля, Кристи, Шелдона или же книги про индейцев. Иногда она придумывала истории, например, про шпионов. Родители всегда открывали дверь в спальне, чтобы тоже послушать ее рассказы. Ее нет уже 16 лет, и я до сих пор скучаю.   "
"Бабушка живёт с моими родителями и мной. У бабушки такой характер, когда никто и никогда, кроме нее, не может быть прав. Ещё и все должно быть так, как скажет она. Нельзя сложить свою кровать так, как удобно, ибо ""это неправильно"". Папа обязательно должен есть больше пяти раз в день, а если он не хочет — это вообще как. Она считает, что никто не может справиться без нее. Когда плохое настроение — орет матом на всех.  Жить так просто невозможно. Ей 70 лет, я просто жду.   "
"Купил бабушке спутниковую тарелку в село, решил установить сам. Минут 20 ловил правильное направление. Бабуля назвала рукожопом, ударила по тарелке деревянной шваброй, и все заработало. Ну как так?   "
"Переезжаю из одного дома в соседний, что находится в пяти минутах ходьбы. Из-за этого решила, что вещи перенесу сама в несколько заходов. При первом и втором заходе с вещами сидевшие на лавочках бабули пристально на меня смотрели. Пароль от подъезда именно для моей квартиры ещё не запомнила, поэтому пользовалась тем, что написан возле двери. Уже при третьем заходе этот пароль был стерт. От этих бабулек пароля я так и не добилась, хоть и объяснила им свою ситуацию. Пришлось возвращаться с огромными пакетами за бумажкой, где записан конкретный пароль для моей квартиры. Вот же старые суки...   "
"Устала — жуть. Чуть ли не запрыгиваю в кровать, ударяюсь обо что-то твёрдое. С удивлением обнаруживаю у себя в кровати бутылку с горячей водой. Оказывается, бабушка, зная, что я приду поздно, а дома холодрыга (батареи не топят), пришла ко мне домой и таким способом решила согреть мне постель...   "
"Когда была маленькой, все выходные и каникулы проводила у бабушки с дедушкой. Там меня всегда ждали и любили. Дедушка это выражал словами — что никогда не даст в обиду и защитит, а бабушка больше делом — приготовит любимую мною еду, купит красивую куклу или одежду.  Однажды на даче, куда мы постоянно с ними ходили, появился новый мальчик. Чем-то я ему не понравилась, и как-то раз он бросил в меня деревяшку. Попал в голову, было больно. Я заплакала и побежала жаловаться. Дедушка покивал головой, а бабушка, подробно у меня все расспросив, отправилась в сторону дома обидчика. Когда она нашла его, спросила, почему он так сделал. Ответ был простой — так захотелось. После этого она очень сильно его толкнула, так, что он улетел на другую сторону двора. Рядом стояли его родственники, но никто ей ничего даже не возразил (ему было около 13 лет, я значительно младше).  За меня больше никто так не заступался.   "
"Работаю в розничной сети. Воруют нечасто, так как везде камеры, но все же воруют. С удивлением отметила, что воруют в основном бабульки, но не самое необходимое, типа хлеб/крупа/кошачий корм, а что подороже — паштет, дорогую ветчину, элитный алкоголь. А как попадаются, начинается ор, посылание всех нахуй и угрозы полицией. Вот вам и божьи одуванчики.   "
"Рядом с домом начали складывать пакеты с мусором. Пару раз доносила до мусорки, но они всё появлялись. А сегодня я увидела бабушку-одуванчик, которая складывала мусор под деревце. Иду с детьми и громко так: ""Смотрите, мои хорошие, вот я вас учу бумажки в урну выкидывать, а уважаемая женщина-пенсионер мусорит. Вроде бы взрослая женщина, а ведёт себя хуже невоспитанного ребёнка!"" Её ответ поразил: ""Ну все поставили, и я поставлю"". Она не убрала. Убрала опять я. А потом они поколение клянут.   "
"Работаю в санатории, провожу процедуры джакузи с эмульсиями. Они бурлят сильно, вода везде. Пришла бабуля за 80 лет, ложится в ванну и надевает МАСКУ СНОУБОРДИСТА! Я задала ей вопрос: ""Зачем?"" И она ответила: ""Вечером танцы, а макияж из-за зрения второй раз делать долго"".   "
"Звонит бабушка, 78 лет. Жалуется, что температура, а лекарства не помогают. Попросила, чтобы купил чего и принёс. Тут же встаю и топаю в аптеку. Прихожу к бабуле с лекарствами и спрашиваю: ""Что это ты такое пила, что не помогло совсем?"" Бабушка достаёт препараты для детей до трёх лет (остались от внука)... Я говорю: ""Бабуль, по возрасту не подходит, поэтому и не помогло!"" А она мне: ""Ох, сынок, думала, откуда ж он знает-то сколько мне лет"". Вот логика. Теперь сам лечу :)   "
"Когда умер мой дедушка, бабушку решили спасать от тоски потоком информации в интернете. Был куплен планшет, проведена фотосессия, в хорошем платье, с причёской и макияжем, зарегистрирована страница в одноклассниках. И вот ей 74 и она в курсе всех новостей, смотрит видео, читает посты, общается с друзьями. И, глядя на неё, вспоминается, как ругала нас с братом за то, что зависаем за компом и тратим деньги на интернет, а сама-то, сама!   "
"Бабушка моя всегда хвасталась наличием ""третьего глаза"", утверждала, что нагадала мужей моим маме и тете, да только никто из них этого не помнил за давностью лет. Я же никогда не просила ее погадать, гадала сама и ничегошеньки не видела (мой третий глаз, видимо, крепко спит). А года четыре назад мы с подружкой остались вместе на рождественскую ночь, чтобы снова попытаться увидеть свое будущее. Я, чисто ради прикола, позвала бабушку. Та попросила стакан с водой, чистый лист бумаги, обручальное кольцо и свечи. Кольцо нужно было положить в стакан и пытаться что-то в нем рассмотреть. И вот стоит бабушка минуту, затем две над стаканом и вдруг кааак закричит: ""Иди быстрее смотри, там какой-то усатый-бородатый!"" Я заглянула внутрь и правда увидела лицо с бородой, но значения этому не придала.      "
"В нашем доме живёт мальчик из бедной семьи. Новой одежды никогда у него не было. Все помогают, как только могут. У некоторых бабушек пошла мода оскорблять подростков, повышая тем самым себе настроение. Сегодня видела, как мальчик шёл по улице, и его остановили две бабушки и спросили: ""У тебя денег нет, чтобы купить новые штанишки?"" Мальчик убежал в слезах, а бабушки просто смеялись.   "
"Моя бабушка — не бабушка вовсе. В свои 69 она работает фельдшером на скорой. Спасает сотни жизней, принимает роды, бьется до последнего. Часто работает сутки через сутки, при этом с подругами гоняет на море, загорает голой, пьёт шампанское и считает, что жить нужно с шармом. Живет она в глухой деревне, но одевается так, что в свои 23 часто беру у неё вещи. У неё сумасшедший начёс и клёш от бедра. Она мой кумир. Но на днях ее не стало. Не смогла жить без любимой работы. Просто не проснулась на пенсии.   "
"Еду как-то в маршрутке с автоматической дверью. На одной остановке заходит пожилая женщина с сумками. Вошла и начинает дёргать дверь, типа закрыть за собой. Водитель ей говорит: ""Дверь автоматическая"". Женщина всё равно дёргает дверь, а водитель ей уже громче: ""Да автоматическая дверь!"" Пофигу, только больше усилий прикладывает. Уже пассажиры хором: ""Дверь автоматическая!"" Оборачивается женщина и со слезами на глазах: ""Я понимаю, что автоматическая, а закрыть то её как?""   "
"Недавно мне рассказали «романтическую» историю о знакомстве и замужестве моих бабушки и дедушки. У бабушки брат был азартным человеком. Любил играть в карты. Однажды брат проиграл сестру в карты... А дедушка предложил на кон поставить мою бабушку, потому что в его деревне уже не было не испорченных им девушек...   "
"Моя бабушка родила маму в 27 лет, а в 28 заболела волчанкой. Всю жизнь сидела на преднизолоне и множестве других лекарств, почти не выходила из дома. Болело у неё практически все, дважды в месяц она делала гастроскопию, лежала в больнице 2-3 раза в год. Это был самый светлый и добрый человек в мире, она всегда помогала, кому могла. Вместо детского сада я сидела с бабушкой, она читала мне, учила вязать, готовить, рассказывала истории из послевоенного детства (родилась в 1937).  Этим летом её не стало. Мы с родителями были в Таиланде, маме надо было отдохнуть (она всю жизнь ухаживала за бабушкой, ездила к ней каждый день, ей было очень тяжело в последнее время), я собиралась замуж, это была последняя семейная поездка с мамой и папой. И вот там мы узнаем, что бабушка в реанимации. Она пыталась принять ванну, упала, поранилась об угол, и её увезли. Мама, узнав это, сразу же купила новый билет на ближайшее время и улетела в Москву. Денег на билеты нам с папой уже не было, и мы остались там ещё на три дня. Нам позвонил дедушка и сказал, что бабушки больше нет, пока мама летела 10 часов в самолёте. В реанимации за бабушкой никто не ухаживал, она была в пролежнях. Кормили её через катетер, в туалет она тоже не могла сходить сама. В ночь перед смертью её выпустили из реанимации, поняв, что все решено. Женщина, сидевшая с ней эту последнюю ночь, говорит, что бабушка повторяла раз за разом: ""Как жаль, что я не успею к внучке на свадьбу, как жаль, что не успею"".  До сих пор плачу, что никогда не обниму бабушку больше, не узнаю рецепт самых вкусных булочек в мире, что один из самых родных людей ушёл навсегда.   "
"Сказала бабушке, что через три дня поеду с друзьями колесить по Европе. Сначала она порадовалась, что я наконец-то куда-то поезду, но буквально через 30 секунд спросила, как я буду питаться, если я могу сварить только макароны, пельмени и пожарить яичницу. Я сказала, что всё будет нормально, и я, если что, куплю еду. Мою бабушку такой ответ не устроил, и вот уже два дня я стою у плиты с бабушкой, которая учит меня готовить. Обожаю бабулю.   "
"Хотела у бабули комнату снять. Знакомимся, значит — пьем чай. У бабки зазвонил телефон, а я решила сбегать в туалет. Пописала, смыла, и тут в туалет забегает бабка, крича, что я охренела воду тратить!  Потом она ознакомила меня с другими правилами: мыться нельзя, а подмываться только водой из унитаза, зачерпывая над тазом. Воду в тазу оставить — ею потом смывать г... Посуду она не моет, а только вытирает. Одежду стирает в реке, зимой — выбивает на снегу.   "
"В детстве после травмы боялась качелей до жути. Три месяца меня водили к психологу три раза в неделю. Страха почти не осталось, специалист был превосходный, но моя бабушка до сих пор уверена, что помогла мне пол-литровая банка ""заговорённой"" воды, которую она купила у местной знахарки.   "
"Бабушка примерно с моих 12 лет все время думала, что я беременна. Пожаловалась на усталость — беременна, отказалась есть — беременна, не отказалась — тем более, за двоих вон ест! Также признаками считалось плохое настроение (гормональный скачок), хорошее настроение (он же), оценки (беременные такие рассеянные!) и так далее. В десятом классе меня прямо с урока увезли в больницу с почечной коликой. Бабушка прибежала к врачу раньше скорой и попросила только не делать аборт.   "
"Шла моя бабушка, будучи первоклассницей, с подружкой из школы. Её детскую любознательность одолел вопрос о возникновении трещин на асфальте. Терзания были вмиг развеяны подружкой, которая с недетской серьёзностью железным голосом молвила: ""По этим трещинам, Надя, кровь Ленина течёт""...   "
"Ненавижу свою бабку. Эта женщина бухала большую часть жизни. Она превратила детство мамы в ад, била ее, когда та была беременна. Все разы, что она жила с нами, клялась, что больше пить не будет, но через пару лет опять срывалась, и мать ее выгоняла. Последние три года она трезво жила с нами. Я была против, когда мать ее привела, но она отмахнулась. Позавчера эта мразь под димедролом украла у нее деньги на квартиру, шаталась по улице и кидалась на людей. Я заебалась и жду ее смерти.   "
"В детстве бабушка пугала меня циститом, воспалением придатков, другими проблемами ""по женски"". Особенно ей нравилась фраза ""Кровью писать будешь!"". И вот представьте мой ужас, когда во время отдыха в компании бабушки и дедушки со мной это-таки произошло! О да, первый день моих месячных я запомнила на всю жизнь.   "
"Была у меня пересдача на права по городу. Со мной в толпе рядом стояла бабуля лет 75 в толстенных очках с дрожащими от старости руками. Я не постеснялась и спросила зачем же ей права, куда ей ездить нужно? На что она весёлым голосом отвечает: ""Как куда, дочка? На кладбище к своим!""   "
"У моей бабули были ужасные тонкие пушистые волосы, большая попа, нос картошкой и грудь шестого размера. Мне от неё достались и волосы, и попа, и нос, но где мои сиськи, ба...   "
"Поликлиника, 8: 30 утра. Узкий и тесный коридор, народу тьма. Все такие унылые сидят. И тут по коридору идёт она - старушка лет 85, с тростью. И выдаёт на весь коридор: ""Чавой такие грустные, а давайте Ламбаду танцевать"". Включает у себя на мобильнике мелодию и давай попой наяривать, вилять на все лады. Настроение подняла на весь день))   "
