"Была когда-то прыщавым подростком. Вот прям сильно прыщавым. Прихожу как-то к бабушке, а она, указывая на мое лицо, говорит, что «хватит колоться, наркомания — зло». Дело было в 90-е, да, наркоманов разных было много. Но чтобы в щеки колоться...   "
"В маршрутке встретила необычную бабулю. Она была одета в стиле pin-up. Я похвалила ее стиль. Оказалось, в молодости она была моделью ню для игральных карт. Рассказала, что это прекрасная работа. Сам политик Вербицкий ее заказывал для совместных фото. Бабуля сказала, что я красивая и должна попробовать что-то такое. Я в шоке, но и призадумалась.   "
"Когда я была маленькой, мы жили рядом с бабушкой. Я часто ходила к ней после школы, и было очень тяжело расставаться, когда за мной приходили родители. В такие моменты она выглядывала в окно и махала мне рукой на прощание, а я плакала ещё сильнее. Я давно выросла, успела переехать, с бабушкой стали видеться реже. И вот я в родном городе, пришла к бабушке в гости, а на прощание она, как и в детстве, махала рукой из окна. Села в машину и разревелась.   "
"Учила бабушку пользоваться палочками для суши, показывала, как фиксировать их пальцами. Когда суши закончились, показывала на других предметах: салфетках, коробочках и прочем. У нее не особо получалось, все падало, но бабушку этот навык очень впечатлил. Сегодня я вернулась с работы, и она с порога очень умело схватила меня палочками за нос)   "
"90-е годы, в поселковый кинотеатр завезли невидаль – эротическое кино. Многие ходили, было интересно глянуть на такое доселе невиданное, тем более на большом экране. Ходили на эти фильмы и местные бабушки-старушки. Заходили – плевались, выходили – плевались, кричали про срам, возмущались и чуть ли не падали в обморок от западной пахабщины и тут же шли на следующий сеанс. Могли так по несколько заходов в день сделать.   "
"Был у меня в детстве случай. Еду на велосипеде по деревне, впереди спуск с горы, а навстречу идет бабушка Груша. И уже не помню, почему так получилось, что я не могла проехать мимо нее, я врезаюсь в бабулю, и мы падаем в разные стороны. Пообещала пожаловаться моим родителям. Прихожу домой и говорю, что врезалась в Грушу. Велосипед в ремонт, колесо погнуто. Не сразу до родителей дошло, что речь о бабушке, думали, я в дерево въехала. Бабуля пришла жаловаться, вопрос урегулировали бутылкой водки.   "
"Мне 21, и мои бабушки до недавнего времени говорили друг другу, что я им не звоню. Хотя звоню обеим через день. Они так делали, потому что думали, что я звоню только одной из них. И, чтобы не расстраивать другую, жаловались, что: «Вот, она мне совсем не звонит». Всё выяснилось, когда я планово позвонила одной из них, когда другая моя бабуля была у неё в гостях. Непонятно, откуда это взялось. И ведь, получается, лет 8 уже длится этот «обман в благих целях».   "
"В моей семье всегда было нормально, если женщины или девочки легко чмокали друг друга в губы (при встрече или на ночь). Однажды, когда мне было примерно лет пять, при встрече с бабушкой уже по привычке хотела легонько её поцеловать, а она засунула свой язык мне в рот, обслюнявив меня всю, а потом сказала: «Нравится? Это так взрослые целуются». До сих пор не понимаю, что это было и зачем это было, но целовать кого-то с тех пор очень противно.   "
"Шли с мужем по Арбату и видим, что идёт плохо одетая бабушка с ходунками. Около лестницы кричит нам: ""Помогите спуститься!"" Подбегаем, а она командует: ""Вот так ставьте, тихонько, не уроните меня!"" Спустили, продолжает: ""Застегните мне шубу, завяжите шарф, сильнее! Прикройте, чтобы дырок не было видно, люди все пуговицы оторвали!"" Я только успевала быстро всё делать, холодно же, и она выдаёт: ""Ребят, вы можете вызвать такси?"" От шока я успела только сказать: ""Нет, спасибо!"" — и мы убежали под её удивлённый взгляд.   "
"Моей бабушке было б 94 года, но не дожила. Летом она устроила генеральную репетицию своих похорон: достала все вещи, оделась, покрутилась, рассмотрела себя и как скинет с ног тапочки. Сказала, что нигде, даже ""там"" не будет одета безвкусно, и в бабушкиных мягких тапочках в гроб не ляжет. После чего достала из шифоньера лаковые туфли на 8 см каблуке и настояла надеть их ей в день похорон. Так и сделали, как она хотела. Вот она какая, настоящая женщина, чтоб красивая даже в деть смерти была.   "
"Когда мне было семь, мы с семьёй жили в пятиэтажном доме. Летом у подъезда постоянно сидели бабушки, но среди них была одна вредная. Когда я бегала утром выбросить мусор, то дверь подъезда не закрывала, ставила камень, чтоб она не заперлась. А эта бабка выжидала и выходила, чтобы запереть дверь. Возвращалась я через пару минут и всё, дверь заперта, эта тварь сидит и пялится на меня, а у меня нет ключей, ибо родители не давали. И так почти каждый день.   "
"Немного боюсь кушать еду у бабушки мужа. Самое простое, что она может натворить, это перепутать ингредиенты. Она для сытости может добавить в салат шпроты, которые вообще там ни к месту. Или маслом залить блины, что с них прям капли масла стекают. Недавно купила красную икру, подала нам на стол, закрались подозрения и не зря. Икра кисло-горькая. Стоила 160 рублей, явно качество не ахти. Теперь реально боюсь отравиться у неё. И обижать не хочется, но и кушать страшно.   "
"Начала снимать комнату у 70-летней бабульки. Весь день она сидит в интернете. В одной социальной сети у неё даже есть фейковая страница, где она страстная брюнетка, которая заводит романы по переписке с молодыми горячими парнями))   "
"Моя бабушка до восьмидесяти лет меняла мужчин как перчатки. Не брезговала ни алкоголиками, ни безработными, ни сидевшими. Всё это блядство стало местью деду за его случайную фразу, что бабушка ""ни баба, ни мужик"". Тогда она пообещала дать первому пастуху. Кстати, с пастуха всё и началось.   "
"Пошли на концерт классической музыки. Сидели в седьмом ряду, всё очень хорошо просматривается. Вдруг с шестого ряда раздаётся шорох — бабушка сидит с внуком и кормит его пирожками, шурша пакетом из-под них. Я не удержалась, шёпотом сделала замечание в перерыве между номерами. От матов бабки вздрогнул и обернулся даже дирижёр.   "
"У бабушки очень молодой голос, как и у всех женщин в семье. Когда позвонили домой по телефону, услышав её, попросили дать трубку ""кому постарше"". И моя бабуля в свои 89 лет позвала меня)   "
"Ехала в полном трамвае. Чувствую, что-то упало на ногу. Опустив глаза, увидела, что на полу лежит большой кошелёк. Стала громко спрашивать: ""Чей кошелёк, кто уронил?"" Ко мне подскочила бабулька и выхватила его из рук. Вежливо улыбнулась, приготовившись сказать ""пожалуйста"", а эта засранка принялась яростно шипеть, что я абсолютно невоспитанна, мол, нечего так вопить и позорить её, и вообще, это сумочка, а не кошелёк. Выругавшись на прощание, ушла.   "
"Бабушка переехала в Москву 40 лет назад, но детство и молодость провела в бедном украинском селе на западе. Она ведёт себя как дворянка: всегда в головном уборе и аккуратном платье, спина прямая, часто ходит в театр и на выставки, говора нет, дикция как у ведущих в СССР. Но когда бабушка созванивается с родственниками, живущими там, она орёт на весь этаж, ржёт конём, а потом наливает себе водки с салом и травит пошлые анекдоты. Через час снова перевоплощается в благородную даму.   "
"Ехала как-то в автобусе и невольно подслушала разговор двух женщин, одна лет пятидесяти, вторая совсем пожилая, такая милая старушка в шляпе и с сумочкой. Она рассказывала, как овдовела и, имея возможность жить в хорошем доме престарелых за какие-то заслуги, не раздумывая, переехала; как обиделся на неё сын, а она ответила, что не за горами время, когда она станет немощной, и не хочет, чтобы он тратил свою жизнь на уход за ней, рассказывала о внуках, какие они у нее молодцы. Я поняла, как я хочу встретить старость - как эта модно одетая бабуля с полной гармонией в душе.   "
"Мой папа — татарин, а мама — славянка. Так уж вышло, что у бабушки по маминой линии из внуков я единственная кареглазая брюнетка со смуглой кожей. Всегда, приезжая в деревню к бабушке, ходили в баню. Бабуля так усердно тёрла меня мочалкой, что походы в баню с ней стали для меня настоящей пыткой. Когда мне исполнилось шесть лет, я не выдержала и сказала: ""Да не стану я белой!"" С тех пор в баню ходила только с мамой.   "
"Было мне лет 13. Жил в селе, водопровода дома не было. Бабушка жила отдельно, начала делать ремонт, провела воду в дом, кое-как обустроила ванную. Иногда, чтобы не мыться в тазу, ходил к ней купаться в ванной. Перегородка, отделяющая ванную от коридора, была из б/у фанеры. И в ней в одном месте было небольшое, с рублевую монету отверстие. И вот как-то купаюсь, делаю свои подростковые дрочливые дела, и вдруг замечаю в этой дырке в стене бабушкин глаз.  До сих пор к бабушке чувствую недоверие.   "
"Моя бабушка была очень строгой и правильной бабушкой. Работала воспитателем и нас с сестрой воспитывала образцово. За плохое поведение лишала сладкого, например. А когда мы выросли, мама рассказала нам, как бабушка наша в молодости с подругой узнали, что муж подруги изменяет — блондинка какая-то прицепилась к нему. И они в кустах с банкой зеленки выжидали эту любовницу. Она потом зеленая в парикмахерскую бежала. А лет пять назад у бабушкиной подруги золотая свадьба была. Отвоевали мужика)))   "
"В детстве я была очень болезненным ребёнком, жутко худючая, ела плохо. Каждый раз, когда заболевала, мама отправляла меня к моей бабушке, которая всю жизнь проработала врачом. Она-то на ноги меня каждый раз и ставила. Несколько лет назад ее не стало, и перед зимой, когда начинали злорадствовать эпидемии, мне приснился сон, где я сижу в ее кабинете, а она сидит напротив меня в белом халатике, заполняя мою карту. После она принесла какой-то шприц и сделала мне укол со словами: ""Больше ты болеть не будешь"". И в ту зиму я впервые ни разу не заболела.   "
"Моя соседка — бабушка 98 лет. Она ходит, но плохо, плохо слышит и живёт с сыном-алкашом, которому 70 лет. Есть ещё две дочери. Они приезжают со своими детьми и внуками очень редко. Её сын с утра до самого вечера где-то ходит, пьёт. Бабуля одна. И каждый день она выходит в подъезд, стучит во все двери и плачет. Просит позвонить её детям, чтобы они пришли. Но никто двери не открывает, потому что её дочери трубки не берут. Для меня она тот ярый показатель того, что просить Бога жить как можно дольше не стоит.   "
"Была в театре, во время спектакля у кого-то зазвонил телефон. Оказалось, что у милой бабульки. Все окружающие стали неодобрительно цокать, как так, пожилой культурный человек, а тут такое. А у бабушки на лице было написано - внуки заставляют ее таскать с собой этот девайс, бедняга просто не знает, как им пользоваться.   "
"Я студентка, устроилась на работу. Пришла к прабабушке (ей 80 лет) и похвалилась, что устроилась менеджером в клининговую компанию. Бабуля нахмурилась и спрашивает у моей мамы: ""Она проституткой что ли теперь работать будет?"" Для бабули все незнакомые ей профессии звучат как проститутка.   "
"Еду после универа домой на метро, сижу с закрытыми глазами, слушаю музыку. Чувствую удар по лбу, сильный такой; открываю глаза, а там бабка жестом показывает, мол, уступи. Я неконфликтный, уступил, пересел. Так на следующей остановке она меня таким же макаром и с другого места согнала! Не выдержал, вышел на следующей. До сих пор думаю, что с ней было не так...   "
"Шла как-то с собеседования на работу. На работу приняли, а денег до дома доехать, да и в принципе, ноль. Подошла к контролеру в метро, объяснила ситуацию, он говорит нет. Говорит, ну, попросите денег на улице. А мне так стыдно. Села на лавочку и расплакалась. Ко мне подсела бабушка, вытерла слезы и сама мне напросила у молодых людей эти несколько десятков рублей, ещё и пирожок дала. Спасибо ей.   "
"У моей бабушки есть суперспособность. Когда она готовит, разумеется ""на глаз"", то никогда не остаётся лишних продуктов. Например, если это пельмени - то тесто раскатывается до последнего кусочка и фарша всегда хватает. Та же фигня с пирожками, тортами и всем, что она готовит. Вот бы эта способность передавалась по наследству.   "
"Встречаюсь с девушкой несколько лет, она живет отдельно от родителей (с ними я в хороших отношениях). Но ее бабушка про меня не знает, так как она старой закалки (вдвоем до свадьбы наедине оставаться нельзя). Как-то вечером был у нее, и тут неожиданно приехала бабушка. Я просидел в шкафу как герой-любовник 2,5 часа, пока бабуля не уехала.   "
"Мама красила батареи в моей комнате. Запах был очень едкий, и спать там было невозможно. Тогда мама отправила меня ночевать вместе с котом к бабушке и дедушке, которые жили ниже нас на 2 этажа. Бабушку я там доводила, и мама пришла меня забирать. Только мы отправились к выходу, бабушка сказала: ""Вы это, кота оставьте, а то надышится!""   "
"Каждый день по пути в универ проезжаю на автобусе мимо бабушек, торгующих овощами со своих огородов. Недавно стала свидетелем сцены, как две такие бабули дрались за своё место. Прямо лупили друг друга деревянными ящиками, на которых обычно раскладывают свой товар. У одной из них в руках даже был сломанный стул без сидушки. Вот это я понимаю конкуренция!   "
"Недавно у меня была свадьба. Мы решили просто расписаться и уехать в Таиланд. За пару месяцев до этого бабушка уже подарила нам подарок, но в день перед отлётом мы с мужем заехали к ней.  Ей было так неудобно, что в сам день свадьбы она ничего не дарит, и бабуля, недолго думая, достала тысячу и стала её пихать нам. Я очень долго не хотела брать, но у неё началась истерика, я думала, она заплачет. Пришлось взять. Люблю бабулю, она самый милый человечек на земле!   "
"Уронила ключи в щель между дверью и асфальтом. Первая мысль: ""Мать меня убьёт"". Поняла, что сказала это вслух только тогда, когда моя соседка, бабуля Маша, ответила: ""Конечно, убьёт!"" Посла чего добавила: ""Ладно, сейчас тебе магнит принесу, будешь рыбачить"". Спустя пятнадцать минут выносит мне магнит на верёвочке, я его в щель опустила и вожу. Слышу звон. Поднимаю — ключи!  Бабушки на лавочках — спасение от любых неприятностях рядом с подъездом :)   "
"Приехали с мужем в гости к бабушке, спать нас уложили на продавленном советском диване. Всю ночь мучалась, наутро пожаловалась, как было тесно и неудобно. В ответ получила: ""Ну, если вам на ЭТОМ тесно, то даже не знаю, что сказать"". И тут я задумалась: она с дедушкой почти всю жизнь проспала на узкой железной кровати, а теперь ютится на сложенном диванчике (какие-то принципы не дают разложить). Человек никогда не лежал с комфортом, и даже не понимает, как это.   "
